key	text	tooltip
pre_battle_speeches_text_S2_PBS_Reinforce_Enemy_Maybe_In_Time_01	I have word that there are more enemy armies coming to fight us. I trust they will be dogged with misfortune every step of the way.	true
pre_battle_speeches_text_S2_PBS_Reinforce_Enemy_Maybe_In_Time_02	We must fight with resolution. There are more enemies near and, unless the spirits misguide them, they may arrive in time to hinder us.	true
pre_battle_speeches_text_S2_PBS_Reinforce_Enemy_Maybe_In_Time_03	I have reports that another clan is marching to join our enemies. I pray that their steps are dogged by misfortune!	true
pre_battle_speeches_text_S2_PBS_Allies_Clan_Uesugi_Here_Token_03	I thank the Uesugi for their efforts here. I can see they have strained every sinew to put a few men into the field.	true
pre_battle_speeches_text_S2_PBS_Allies_Clan_Uesugi_Here_Token_02	It is a fine thing that Uesugi do: they support us in this fight even though it must be a strain on their clan.	true
pre_battle_speeches_text_S2_PBS_Allies_Clan_Uesugi_Here_Token_01	I am glad that the Uesugi sent soldiers to our aid, but saddened that they are so few, but aid from worthy men is welcome.	true
pre_battle_speeches_text_S2_PBS_Army_Enemy_Elite_Archers_01	The enemy have many skilled archers in their ranks. Long years of practice make sure men deadly, and we would do well to respect them. And kill them.	true
pre_battle_speeches_text_S2_PBS_Army_Enemy_Elite_Archers_02	Our enemies have mighty archers with them. These men are rightly respected. They die like lesser bowmen, though, at the touch of a sword!	true
pre_battle_speeches_text_S2_PBS_Army_Enemy_Elite_Archers_03	I see that our enemy has brought some skilled bowmen to this battle. Well, no matter! We fight in any storm: rain, snow or arrows!	true
pre_battle_speeches_text_S2_PBS_Ending_Clan_Takeda_10	And remember: what we do here will echo for a thousand years in the legends of the Takeda clan!	true
pre_battle_speeches_text_S2_PBS_Hoorah_heroic_land_35	Live long in honour, worthy heroes! I wish you success!	true
pre_battle_speeches_text_S2_PBS_Hoorah_heroic_land_34	Heroes of our clan! May you find glory and victory!	true
pre_battle_speeches_text_S2_PBS_Hoorah_heroic_land_37	Heroes, this is your moment of glory, when all men can see your worth!	true
pre_battle_speeches_text_S2_PBS_Hoorah_heroic_land_36	I pray you find brave and noble foes, so that your honour is proved!	true
pre_battle_speeches_text_S2_PBS_Hoorah_heroic_land_31	Mighty heroes! Destiny awaits you!	true
pre_battle_speeches_text_S2_PBS_Hoorah_heroic_land_30	Spirits of the air! Cool the brows of these, my worthy heroes!	true
pre_battle_speeches_text_S2_PBS_Hoorah_heroic_land_33	Great heroes, I pray you find truly worth opponents!	true
pre_battle_speeches_text_S2_PBS_Hoorah_heroic_land_32	Mighty heroes! Let your deeds today live for ten thousand years!	true
pre_battle_speeches_text_S2_PBS_Hoorah_heroic_land_39	Noble heroes, show your ancestors that you are worthy of them!	true
pre_battle_speeches_text_S2_PBS_Hoorah_heroic_land_38	Fight well, noble heroes, for all our clan watches you!	true
pre_battle_speeches_text_S2_PBS_Ending_Clan_Takeda_03	Now, my Takeda brothers, give a cheer. Let the enemy hear that you do not count them much of a threat!	true
pre_battle_speeches_text_S2_PBS_Ending_Clan_Takeda_02	And now, sons of the Takeda, stand and fight. Be as immovable in spirit as a mountain!	true
pre_battle_speeches_text_S2_PBS_Ending_Clan_Takeda_01	And finally, remember that we are the Takeda! We fight, we die, but we are always Takeda!	true
pre_battle_speeches_text_S2_PBS_Ending_Clan_Takeda_07	And now cheer, let the foe know doubt and fear! Deafen the fools with Takeda courage!	true
pre_battle_speeches_text_S2_PBS_Ending_Clan_Takeda_06	And now hold aloft the banners of our Takeda clan! Let the foe see who comes, and let them hear your courage!	true
pre_battle_speeches_text_S2_PBS_Ending_Clan_Takeda_05	Now, my fine Takeda soldiers, we must kill and kill again. Their deaths are necessary, if regretable.	true
pre_battle_speeches_text_S2_PBS_Ending_Clan_Takeda_04	Now, my Takeda warriors, give them a lusty, mountain cheer! Show them that we are ready and waiting to kill them!	true
pre_battle_speeches_text_S2_PBS_Ending_Clan_Takeda_09	And so to battle, my Takeda brothers! Now we prove our worth! I know that none of us will be found wanting!	true
pre_battle_speeches_text_S2_PBS_Ending_Clan_Takeda_08	And now we fight! Think only of your Takeda honour, kill your foe, and all will be well!	true
pre_battle_speeches_text_S2_PBS_Hoorah_heroic_land_25	I pray for your victories, heroes!	true
pre_battle_speeches_text_S2_PBS_Hoorah_heroic_land_24	Strength to you, heroes, as you face your challenges!	true
pre_battle_speeches_text_S2_PBS_Hoorah_heroic_land_27	My prayers go with you as you seek honour today!	true
pre_battle_speeches_text_S2_PBS_Hoorah_heroic_land_26	This the moment for heroes to step forth and claim honour!	true
pre_battle_speeches_text_S2_PBS_Ending_Trait_Drunkard_03	And now, I send you off to fight our foes, the horrible fish-faced devils with their scaly knees and goggly eyes. No, that's my wife's family! Anyway, good luck to you all!	true
pre_battle_speeches_text_S2_PBS_Hoorah_heroic_land_21	And now, heroes, let duty guide your hearts!	true
pre_battle_speeches_text_S2_PBS_Ending_Trait_Drunkard_02	And now I drink to your success. I have a flask or two that need my attention, you know. And try not to be too loud when you fight. Terribly bad for the digestion, too much noise…	true
pre_battle_speeches_text_S2_PBS_Hoorah_heroic_land_20	Fight! For your families and your honour!	true
pre_battle_speeches_text_S2_PBS_Ending_Trait_Drunkard_01	And now, I refill my sake cup and raise it in your honour! You are fine fellows, and I admire and deeply love you all! Oh yes, much, much, more than I can say…	true
pre_battle_speeches_text_S2_PBS_Hoorah_heroic_land_23	Now, heroes, show you are worthy of that name!	true
pre_battle_speeches_text_S2_PBS_Hoorah_heroic_land_22	Now, let glory and honour find champions among us!	true
pre_battle_speeches_text_S2_PBS_Hoorah_heroic_land_29	Seek out a man worth fighting, and cut him down!	true
pre_battle_speeches_text_S2_PBS_Hoorah_heroic_land_28	Seek out a worthy foe, and prove your courage!	true
pre_battle_speeches_text_S2_PBS_Army_Enemy_Archers_Not_Enough_01	The enemy have been unwise. They should have brought more archers. Their ranks are not harmonious, and we can exploit this.	true
pre_battle_speeches_text_S2_PBS_Army_Enemy_Archers_Not_Enough_03	My opponent lacks military wisdom. Good strategy should tell him to employ more archers on this field, but he does not. This is foolishness.	true
pre_battle_speeches_text_S2_PBS_Army_Enemy_Archers_Not_Enough_02	By my count, our foes lack archers. This is good, and a weakness to be ruthlessly exploited! Why should I fight fairly against fools?	true
pre_battle_speeches_text_S2_PBS_Allies_Clan_Wee_Faction_Here_Adequate_01	I am heartened to see our allies on the field. Their clan may be few in number, but their honour is without measure!	true
pre_battle_speeches_text_S2_PBS_Allies_Clan_Wee_Faction_Here_Adequate_02	It is good to have allies on such a day. They have proved their worth and their valour already. Let us show them ours!	true
pre_battle_speeches_text_S2_PBS_Allies_Clan_Wee_Faction_Here_Adequate_03	I thank our allies for their support. Their warriors make a fine show, and must dishearten the foe.	true
pre_battle_speeches_text_S2_PBS_Hoorah_heroic_land_15	Mighty heroes: my prayers go with you!	true
pre_battle_speeches_text_S2_PBS_Hoorah_heroic_land_14	Spirits! Grant our heroes a victory here!	true
pre_battle_speeches_text_S2_PBS_Hoorah_heroic_land_17	Fight with honour, heroes of our clan!	true
pre_battle_speeches_text_S2_PBS_Hoorah_heroic_land_16	You have my prayers, brave heroes! Now fight!	true
pre_battle_speeches_text_S2_PBS_Hoorah_heroic_land_11	Take your places in line! Fight well, my heroes!	true
pre_battle_speeches_text_S2_PBS_Hoorah_heroic_land_10	Now, heroes, show our foes the meaning of duty!	true
pre_battle_speeches_text_S2_PBS_Hoorah_heroic_land_13	Now, heroes, send your foes to Hell!	true
pre_battle_speeches_text_S2_PBS_Hoorah_heroic_land_12	Heroes of our clan! As always, fight bravely!	true
pre_battle_speeches_text_S2_PBS_Hoorah_heroic_land_19	Now, heroes of our people, advance with resolute hearts!	true
pre_battle_speeches_text_S2_PBS_Hoorah_heroic_land_18	Strike them down, heroes! We will have victory here!	true
pre_battle_speeches_text_S2_PBS_Hoorah_heroic_land_05	Heroes! Show them what honour truly means!	true
pre_battle_speeches_text_S2_PBS_Hoorah_heroic_land_04	And now, heroes of our clan, fight with honour!	true
pre_battle_speeches_text_S2_PBS_Hoorah_heroic_land_07	Now, prove yourselves worthy of our clan!	true
pre_battle_speeches_text_S2_PBS_Hoorah_heroic_land_06	And now, worthy heroes, your moment has come!	true
pre_battle_speeches_text_S2_PBS_Hoorah_heroic_land_01	And now, heroes: kill them all!	true
pre_battle_speeches_text_S2_PBS_Hoorah_heroic_land_03	Draw your swords, heroes, and give them death!	true
pre_battle_speeches_text_S2_PBS_Hoorah_heroic_land_02	Let the heroes step forward, and show them death!	true
pre_battle_speeches_text_S2_PBS_Hoorah_heroic_land_09	Take up your weapons, and do your worst!	true
pre_battle_speeches_text_S2_PBS_Hoorah_heroic_land_08	Now is the time! Do not dishonour the clan!	true
pre_battle_speeches_text_S2_PBS_Ending_Clan_Hojo_07	Now, my brothers in arms, it is time to show our foes the meaning of Hojo courage! Make ready!	true
pre_battle_speeches_text_S2_PBS_Ending_Clan_Hojo_06	And now, cheer you brave souls! Show your foes that the Hojo are coming for them!	true
pre_battle_speeches_text_S2_PBS_Ending_Clan_Hojo_05	And now, we are ready. We Hojo have always been ready for victory, and today is no different!	true
pre_battle_speeches_text_S2_PBS_Ending_Clan_Hojo_04	And now, we must go to set the world aright! Fight bravely, Hojo warriors, and victory will be our reward!	true
pre_battle_speeches_text_S2_PBS_Ending_Clan_Hojo_03	And now, my Hojo soldiers, shout the heavens, and remind the gods why we are worthy of victory!	true
pre_battle_speeches_text_S2_PBS_Ending_Clan_Hojo_02	Now, stand, proud Hojo, and remember your faith, honour and duty! Be brave! Be strong!	true
pre_battle_speeches_text_S2_PBS_Ending_Clan_Hojo_01	And at the last, remember you are Hojo! It is a proud thing, and the source of your strength!	true
pre_battle_speeches_text_S2_PBS_Strategy_Clan_Allies_Faction_Leader_Here_02	Our ally has done us a great honour to fight with us in person. His lordly presence should inspire us all to greater efforts.	true
pre_battle_speeches_text_S2_PBS_Strategy_Clan_Allies_Faction_Leader_Here_03	If nothing else, fight with pride, because the eyes of an allied lord are on us today. Show him that we are worthy friends!	true
pre_battle_speeches_text_S2_PBS_Ending_Clan_Hojo_09	And now, think kindly of your loved ones. We fight for them, and our great Hojo clan! And we will prevail!	true
pre_battle_speeches_text_S2_PBS_Ending_Clan_Hojo_08	Now we will show them what Hojo courage means, and what steadfast obedience and true faith can achieve! To arms!	true
pre_battle_speeches_text_S2_PBS_Strategy_Clan_Allies_Faction_Leader_Here_01	The mighty lord of our esteemed allies stands alongside us today! Be proud of this, and turn that pride into strength.	true
pre_battle_speeches_text_S2_PBS_Ending_Clan_Mori_09	And remember: they do not have one tenth of our Mori cunning, nor one tenth of our Mori courage!	true
pre_battle_speeches_text_S2_PBS_Ending_Clan_Mori_08	Now, men, cheer, and raise up our Mori banners! Stand proudly in their shadow, and then fight like demons!	true
pre_battle_speeches_text_S2_PBS_Ending_Clan_Mori_07	Now, let us show these fools that the Mori do not fight with swords alone, but with cunning! Let us crush them!	true
pre_battle_speeches_text_S2_PBS_Ending_Clan_Mori_06	And now, let us show courage, and Mori courage at that! We are better than our foes in every respect!	true
pre_battle_speeches_text_S2_PBS_Ending_Clan_Mori_05	And now, worthy soldiers of the Mori, make ready! We must show the enemy the true meaning of courage!	true
pre_battle_speeches_text_S2_PBS_Ending_Clan_Mori_04	And remember, my Mori warriors, that we are cunning as well as brave. We will win, because of that!	true
pre_battle_speeches_text_S2_PBS_Ending_Clan_Mori_03	And now, proud Mori, shout out, and turn the enemies' guts to water!	true
pre_battle_speeches_text_S2_PBS_Ending_Clan_Mori_02	Now, warriors of the Mori, stand fast! Remember your duty, and we will triumph!	true
pre_battle_speeches_text_S2_PBS_Ending_Clan_Mori_01	And at the last, remember you are Mori! Our cunning will serve us well!	true
pre_battle_speeches_text_S2_PBS_Battle_Land_Defend_Hills_02	Let our foes come! Marching in armour is always wearisome, and doubly so over hills. We shall let tired men come to their deaths!	true
pre_battle_speeches_text_S2_PBS_Battle_Land_Defend_Hills_03	We will hold these hills, and let our enemies tire themselves be scrambling up to meet us! The higher ground always favours the defenders!	true
pre_battle_speeches_text_S2_PBS_Battle_Land_Defend_Hills_01	There are worse places in battle than in these hills. Let our foes wear themselves out  coming to us. Then they will fall to our blades!	true
pre_battle_speeches_text_S2_PBS_Army_Enemy_Artillery_Not_Enough_01	The enemy commander has failed before he has begun. Perhaps he values tradition more than wisdom, but he has not brought enough artillery to the fight!	true
pre_battle_speeches_text_S2_PBS_Army_Enemy_Artillery_Not_Enough_02	I have counted their artillery, and I consider it wanting! This is most heartening! A foe who cannot arrange their army properly cannot fight properly!	true
pre_battle_speeches_text_S2_PBS_Army_Enemy_Artillery_Not_Enough_03	I do not think our enemies have given enough thought to their army. It lacks artillery, and this weakness may be its undoing.	true
pre_battle_speeches_text_S2_PBS_Allies_Enemy_Uesugi_Here_Strong_03	There are too many Uesugi banners among those of our enemies. I had not thought them so committed to their so-called allies.	true
pre_battle_speeches_text_S2_PBS_Allies_Enemy_Uesugi_Here_Strong_02	The Uesugi have great faith in their allies, to send men in such numbers. Poor fools, their faith is misplaced.	true
pre_battle_speeches_text_S2_PBS_Allies_Enemy_Uesugi_Here_Strong_01	I see our foes have persuaded the Uesugi to die for them, and in great numbers. Ah, I pity the Uesugi, to be so used.	true
pre_battle_speeches_text_S2_PBS_Intro_Trait_Skill_Ashigaru_General_02	I am a common man made great, I admit, by events. This battle will make you great men if you let it, if you win it.	true
pre_battle_speeches_text_S2_PBS_Intro_Trait_Skill_Ashigaru_General_03	I will not flatter you with soft words, my brother warriors. There are enemies, and they are dangerous. But you are more dangerous!	true
pre_battle_speeches_text_S2_PBS_Intro_Trait_Skill_Ashigaru_General_01	Men, men, men... this will not be an easy fight! No battle is ever easy, but I would not have dishonesty between us. So, let's to it.	true
pre_battle_speeches_text_S2_PBS_Ending_Clan_Hojo_10	And now, Hojo warriors, prepare to be heroes! Our daimyo expects nothing less from us!	true
pre_battle_speeches_text_S2_PBS_Army_Enemy_Elite_Samurai_01	I see that our enemies include some mighty samurai warriors. Treat these men with caution, but do not fear them. They die like ordinary men.	true
pre_battle_speeches_text_S2_PBS_Army_Enemy_Elite_Samurai_02	There are many mighty samurai among the enemy. It is good to face worthy opponents, for honour grows with each one that we defeat! 	true
pre_battle_speeches_text_S2_PBS_Army_Enemy_Elite_Samurai_03	There are great samurai warriors standing in the enemy ranks. I do not like to think of so many honourable men being killed for so paltry a cause.	true
pre_battle_speeches_text_S2_PBS_Ending_Clan_Mori_10	And so shortly we will fight! We will fight for our great Mori clan and, even if we die, we will serve our daimyo well!	true
pre_battle_speeches_text_S2_PBS_Clan_Taisho_Record_Victorious_Lots_03	Today I wish to remain a stranger to defeat. I think that you will prove worthy in the field, and all will be well.	true
pre_battle_speeches_text_S2_PBS_Clan_Taisho_Record_Victorious_Lots_02	I have fought and won many battles. Today, I will add to my tally of victories. And you will have tales to tell your grandchildren!	true
pre_battle_speeches_text_S2_PBS_Clan_Taisho_Record_Victorious_Lots_01	Take heart from my experience, men. I have rarely lost a fight, and I do not intend to lose today! But why should I, with you under my command?	true
pre_battle_speeches_text_S2_PBS_Battle_Land_Weather_Good_03	This is a day to fill the soul of a warrior with joy! A battle, an adversary, and gentle breezes to cool the brow!  	true
pre_battle_speeches_text_S2_PBS_Battle_Land_Weather_Good_02	This weather is most welcome. It reminds me of childhood days. If one is to fight a battle, then what can be finer than a day like this? 	true
pre_battle_speeches_text_S2_PBS_Battle_Land_Weather_Good_01	This is a fine day. The breeze is gentle, and all that is lacking are the peaceful notes of a flute floating upon it. 	true
pre_battle_speeches_text_S2_PBS_Battle_Sea_Weather_Mists_03	These mists can hide enemy ships, and deceive the eye! Trust in yourselves and your mastery of the waves! Trust in your swords and weapons!	true
pre_battle_speeches_text_S2_PBS_Battle_Sea_Weather_Mists_02	We must be careful in this mist. If we are careless the spirits will send us astray! But then, they may do the same to our foes!	true
pre_battle_speeches_text_S2_PBS_Battle_Sea_Weather_Mists_01	Ah, these mists are not sent to try us! No! We will use what the sea spirits have given us, and conceal our intentions from the enemy!	true
pre_battle_speeches_text_S2_PBS_Allies_Clan_Uesugi_Here_Adequate_01	I am heartened that the Uesugi clan have sent warriors to our aid. They do us honour, and we should show them our worth!	true
pre_battle_speeches_text_S2_PBS_Allies_Clan_Uesugi_Here_Adequate_03	I am happy to see the Uesugi clan here in such numbers. They are true allies in war.	true
pre_battle_speeches_text_S2_PBS_Allies_Clan_Uesugi_Here_Adequate_02	My thanks to the Uesugi commander for bringing such a brave army to our aid. It is a fine and inspiring sight!	true
pre_battle_speeches_text_S2_PBS_Strategy_Enemy_Ally_Faction_Leader_Here_01	I see that our enemy have a daimyo on the field. Their allies, worthless dogs all, have brought their so-called lord with them! He should die!	true
pre_battle_speeches_text_S2_PBS_Strategy_Enemy_Ally_Faction_Leader_Here_03	This is a day to prove your bravery, for the enemies' allies are commanded by their lord. He will witness your worth, and know despair!	true
pre_battle_speeches_text_S2_PBS_Strategy_Enemy_Ally_Faction_Leader_Here_02	Our enemies have a friend on the field. Their allies are lead by their daimyo. The man that  brings me his banner earns my undying gratitude!	true
pre_battle_speeches_text_S2_PBS_Army_Clan_Archers_Too_Many_01	If I could change one thing, I would have fewer archers. No matter. We will shoot our foes, rather than cut them down!	true
pre_battle_speeches_text_S2_PBS_Army_Clan_Archers_Too_Many_03	I will not lie: this army is not perfect. We have many archers for the battle to come, and this may prove a weakness rather than a strength.	true
pre_battle_speeches_text_S2_PBS_Army_Clan_Archers_Too_Many_02	I am pleased to have so many archers here. Indeed, we are so well provided with bowmen that they may yet have to fight had-to-hand!	true
pre_battle_speeches_text_S2_PBS_Army_Clan_Samurai_Too_Many_01	I am pleased to see so many samurai in our ranks! You add lustre to our force! But we could also have used other troops, with other skills.	true
pre_battle_speeches_text_S2_PBS_Allies_Enemy_Date_Here_Strong_01	I see many Date banners over there. I had not realised our foes thought themselves so weak, to need so many allies.	true
pre_battle_speeches_text_S2_PBS_Allies_Enemy_Date_Here_Strong_02	You will see that the Date have joined our enemy in great numbers. What of it? Their reputation is overblown.	true
pre_battle_speeches_text_S2_PBS_Army_Clan_Samurai_Too_Many_03	Samurai warriors! You are the beating heart of this army! It is your duty to be strong and resolute, for your numbers are great indeed.	true
pre_battle_speeches_text_S2_PBS_Allies_Enemy_Date_Here_Strong_03	The Date clan, then, value their alliance with our enemies. It is not like them to risk their own men in such numbers.	true
pre_battle_speeches_text_S2_PBS_Army_Clan_Samurai_Too_Many_02	Samurai! You will be the spearpoint, thrust into the enemy! Do not let your enthusiam get the better of you! I may not have other troops to support you!	true
pre_battle_speeches_text_S2_PBS_Hoorah_heroic_land_40	Your ancestors are watching, heroes! Make sure they are not ashamed!	true
pre_battle_speeches_text_S2_PBS_Battle_Land_Defend_Woods_02	These trees are most excellent. We can use them as cover. I apologise in advance to the kodama for our enemies' poor manners.	true
pre_battle_speeches_text_S2_PBS_ID_Enemy_Rebel_Ronin_Hated_04	Our enemies were once men of honour, but not now! They have forfeited duty and soon, thanks to you, they will forfeit their worthless, wasted lives!	true
pre_battle_speeches_text_S2_PBS_Battle_Land_Defend_Woods_03	These trees have stood here for a long time. Treat them kindly, even as you use them for cover, and watch for the enemy hiding among them!	true
pre_battle_speeches_text_S2_PBS_ID_Enemy_Rebel_Ronin_Hated_05	I despise these ronin! Why could they not retain honour when they lost their rightful masters? The way of the warrior is the acceptance of death!	true
pre_battle_speeches_text_S2_PBS_Battle_Land_Defend_Woods_01	I like these woods. Trees have long lives, and remember things men do not. If we treat them with respect, they will hide our intentions from the enemy.	true
pre_battle_speeches_text_S2_PBS_ID_Enemy_Rebel_Ronin_Hated_01	Our foes are men without honour, ronin who should have chosen suicide rather than rebellion. When we are done, they will be glad of death!	true
pre_battle_speeches_text_S2_PBS_ID_Enemy_Rebel_Ronin_Hated_02	The fate of a ronin is hard: with a master, without a clan, without hope! But these men have gone further: they are without honour!	true
pre_battle_speeches_text_S2_PBS_ID_Enemy_Rebel_Ronin_Hated_03	To lose your master may be unfair and cruel. But it does not excuse taking up arms in this fashion! These ronin have forfeited everything, including their lives!	true
pre_battle_speeches_text_S2_PBS_Allies_Clan_Tokugawa_Here_Adequate_01	Our Tokugawa allies have honoured the treaty, and I thank them for their presence beside you, our brave warriors.	true
pre_battle_speeches_text_S2_PBS_Allies_Clan_Tokugawa_Here_Adequate_02	And now I thank our Tokugawa allies. Their banners fly besides ours, and our enemies must feel some disquiet at the sight!	true
pre_battle_speeches_text_S2_PBS_Allies_Clan_Tokugawa_Here_Adequate_03	I salute the Tokugawa, and thank them for their aid. Our cause is strengthened by their presence here.	true
pre_battle_speeches_text_S2_PBS_Battle_Land_Attack_Castle_Large_01	The defences we must take are large and impressive. The enemy hope they are enough. Against lesser men, it might well be so.	true
pre_battle_speeches_text_S2_PBS_Battle_Land_Attack_Castle_Large_03	So, we attack the walls! Be resolute, wait for your chance, and then advance with speed and determination. Give the defenders no chance to hold!	true
pre_battle_speeches_text_S2_PBS_Battle_Land_Attack_Castle_Large_02	The walls here look strong, but we can take them. The defenders know this, and they fear our assault. It must be swift, merciless and implacable!	true
pre_battle_speeches_text_S2_PBS_Intro_General_Family_5_Unrelated_Age_3_Old_01	I am an old man, yet I stand ready for battle. I face death for our clan! I expect nothing less from you!	true
pre_battle_speeches_text_S2_PBS_Intro_General_Family_5_Unrelated_Age_3_Old_03	Age may have given me grey hairs, but it has not dimmed my appetite for victory! Today, we will feast on that dish!	true
pre_battle_speeches_text_S2_PBS_Intro_General_Family_5_Unrelated_Age_3_Old_02	Some of you may think me an old man. You have no respect, if you think because I am old I will not fight! Today we will all fight: yes, and die if needs be, for we are warriors!	true
pre_battle_speeches_text_S2_PBS_Army_Enemy_Cavalry_Not_Enough_02	The general yonder does not like horses, if my count of his troops is correct. He has not brought enough cavalry to this fight!	true
pre_battle_speeches_text_S2_PBS_Army_Enemy_Cavalry_Not_Enough_03	By my count, I think our enemies lack cavalry. They may not react quickly to our actions, and this is a weakness we can exploit mercilessly!	true
pre_battle_speeches_text_S2_PBS_Army_Enemy_Cavalry_Not_Enough_01	Ah! I think I see a weakness in their ranks. Perhaps we can exploit it! They have not brought many horsemen to this battle.	true
pre_battle_speeches_text_S2_PBS_Allies_Enemy_Hojo_Here_Strong_02	I see that Hojo honour has outweighed Hojo common sense. Why else would they send so many men to support our foes?	true
pre_battle_speeches_text_S2_PBS_Allies_Enemy_Hojo_Here_Strong_03	The Hojo are indeed honourable, but beyond honour is foolishness! They have sent far too great a force to aid our foes!	true
pre_battle_speeches_text_S2_PBS_Allies_Enemy_Hojo_Here_Strong_01	I see that the Hojo have kept their word, and stand alongside our foes. I weep that so many warriors will meet death shortly.	true
pre_battle_speeches_text_S2_PBS_Allies_Enemy_Mori_Here_Strong_02	I think our foes must have lied to the Mori. Perhaps they promised them much booty from our corpses! That would explain their numbers!	true
