key	text	tooltip
pre_battle_speeches_text_S2_PBS_Army_Comparison_Equal_Strength_Equal_Numbers_02	I see that our foes just about match our strength. Well then, my warriors, perhaps the courage of a single man will win the day!	true
pre_battle_speeches_text_S2_PBS_Army_Comparison_Equal_Strength_Equal_Numbers_01	So, our strength is well matched! This may be a hard battle. Courage, good generalship and obedience to orders will win it, not mere numbers.	true
pre_battle_speeches_text_S2_PBS_Allies_Clan_Hattori_Here_Token_01	I thank the noble Hattori clan for their presence! I had hoped for more men, but their worth is not measured by mere numbers!	true
pre_battle_speeches_text_S2_PBS_Allies_Clan_Hattori_Here_Token_03	One Hattori warrior, it is said, has all the cunning of a fox! It is good, then, that even a few Hattori stand with us.	true
pre_battle_speeches_text_S2_PBS_Allies_Clan_Hattori_Here_Token_02	The Hattori honour us with their presence. Their numbers belie their cunning and skill as warriors, as we will surely see today.	true
pre_battle_speeches_text_S2_PBS_Battle_Sea_Attack_Lee_Shore_01	Our enemies are fools! They have put themselves in a poor position. With us to windward and a shore beyond them, they are trapped!	true
pre_battle_speeches_text_S2_PBS_Battle_Sea_Attack_Lee_Shore_02	I see our foes are not seamasters, but only fools! Why else would they have the rocky shore in their lee, ready to destroy their vessels?	true
pre_battle_speeches_text_S2_PBS_Battle_Sea_Attack_Lee_Shore_03	It may not be honourable, but driving our foe onto the shore will defeat them as surely as any swordplay. Ah, victory is what counts!	true
pre_battle_speeches_text_S2_PBS_Quip_vs_Rebel_Ronin_09	Death is the only reward our foes can expect! They will die dishonoured and unclaimed by clan or family! That is the penalty for rebellion!	true
pre_battle_speeches_text_S2_PBS_Quip_vs_Rebel_Ronin_08	Warriors, we face a cunning foe! These ronin have all the skill of honest warriors, but not one shred of honour! So: we are stronger!	true
pre_battle_speeches_text_S2_PBS_Quip_vs_Rebel_Ronin_03	We shall wash these rebels away in a tide of their own blood! I will give them no quarter! You will give them only death!	true
pre_battle_speeches_text_S2_PBS_Quip_vs_Rebel_Ronin_02	I apologise, my loyal warriors, for making you fight vermin! Once these swine had honour, but there is little left to them save the deaths that we bring now.	true
pre_battle_speeches_text_S2_PBS_Quip_vs_Rebel_Ronin_01	Warriors-- there is little honour to be found in facing stray dogs, but duty is duty! These masterless fools must be slaughtered!	true
pre_battle_speeches_text_S2_PBS_Quip_vs_Rebel_Ronin_07	These ronin think they have unleashed a storm-- and they have! But it is not their rebellion, only our righteous anger! Make ready!	true
pre_battle_speeches_text_S2_PBS_Quip_vs_Rebel_Ronin_06	I feel sorry for these rebels. Their only cause is ambition, a foul excess to any honest samurai. They will be happier dead at our hands.	true
pre_battle_speeches_text_S2_PBS_Quip_vs_Rebel_Ronin_05	Ronin scum! Masterless and faithless to a man! And now they raise rebellion against their betters! It is time to put them in their graves!	true
pre_battle_speeches_text_S2_PBS_Quip_vs_Rebel_Ronin_04	These masterless wretches deserve some respect, but not too much. They are mad dogs, and should be treated with caution, lest they pass on their madness!	true
pre_battle_speeches_text_S2_PBS_Quip_vs_Rebel_Ronin_10	I feel for these ronin! They have been robbed of duty, honour and purpose! But I feel anger that chaos is their response! Make ready!	true
pre_battle_speeches_text_S2_PBS_Intro_Trait_Skill_Warrior_01	You all know that I am a practical man, a warrior suited to battle, not to ceremony! So: I give you foes to slay!	true
pre_battle_speeches_text_S2_PBS_Intro_Trait_Skill_Warrior_02	This is a day for fighting, not for show. Do your best and I, your comrade in arms, promise you a victory.	true
pre_battle_speeches_text_S2_PBS_Intro_Trait_Skill_Warrior_03	Whenever I face battle, I do two things: I empty my bowels, and I inspect my sword. I am, at heart, a practical man, and I advise you to be the same!	true
pre_battle_speeches_text_S2_PBS_Allies_Clan_Date_Near_Maybe_03	I hear that a Date army is nearby. Good! I will take the aid of fierce men if they come in time!	true
pre_battle_speeches_text_S2_PBS_Allies_Clan_Date_Near_Maybe_02	I have word that the Date are coming to our aid. I trust that their fierce nature will not be blunted by hard marching. 	true
pre_battle_speeches_text_S2_PBS_Allies_Clan_Date_Near_Maybe_01	Word has come that our Date allies are near and may yet arrive. Let us hope that their skill in marching matches their fierceness!	true
pre_battle_speeches_text_S2_PBS_Army_Comparison_Them_Weaker_More_Men_03	I did think to count the enemy, but it will be easier once they are dead! Their numbers mean nothing, for they have weak hearts.	true
pre_battle_speeches_text_S2_PBS_Army_Comparison_Them_Weaker_More_Men_02	So, I see that they outnumber us! So what? I stand with true warriors, men with iron in their souls. They are weaklings, worthless to a man. 	true
pre_battle_speeches_text_S2_PBS_Army_Comparison_Them_Weaker_More_Men_01	Do not let the number of our foes deceive you. Few of them are your equals, and I would hazard a guess that none are better men. 	true
pre_battle_speeches_text_S2_PBS_Reinforce_Clan_Maybe_Late_01	And although our clan brothers are coming to our aid, sometimes men make their own luck! We live or die here by our own efforts!	true
pre_battle_speeches_text_S2_PBS_Reinforce_Clan_Maybe_Late_02	And, warriors, although aid is coming I will not rely on it. I say we can -- we will -- have victory before help comes!	true
pre_battle_speeches_text_S2_PBS_Reinforce_Clan_Maybe_Late_03	Why should we rely on reinforcements? Our brothers are coming, but we have the strength we need to prevail! Take up your swords, then!	true
pre_battle_speeches_text_S2_PBS_Allies_Clan_Hattori_Near_Maybe_01	There is every chance that the Hattori clan will come! Their reputation for trickery will serve us well, should they arrive in time!	true
pre_battle_speeches_text_S2_PBS_Allies_Clan_Hattori_Near_Maybe_02	I have reports that the Hattori approach! They are cunning warriors, and even the rumour of their coming will dishearten our foes!	true
pre_battle_speeches_text_S2_PBS_Allies_Clan_Hattori_Near_Maybe_03	Even now, the Hattori are coming! I hope the spirits will guide their steps but, if not, we are honoured by their attempt to help.	true
pre_battle_speeches_text_S2_PBS_Allies_Clan_Ashikaga_Shogunate_Here_Token_01	I thank our noble allies, the Ashikaga, for their support! I had hoped for greater numbers, but their honour alone is a source of great strength.	true
pre_battle_speeches_text_S2_PBS_Allies_Clan_Ashikaga_Shogunate_Here_Token_02	I had hoped to see more soldiers in the field beneath Ashikaga banners, but each and every one of them is welcome today!	true
pre_battle_speeches_text_S2_PBS_Allies_Clan_Ashikaga_Shogunate_Here_Token_03	I salute our Ashikaga allies! I had hoped to salute a good many more of them, but these few are doubly welcome because of their rarity today!	true
pre_battle_speeches_text_S2_PBS_ID_Enemy_Clan_Uesugi_Respected_10	The Uesugi yonder are honourable people, but their prayers for aid must weary the gods! Can these men not stand up for themselves?	true
pre_battle_speeches_text_S2_PBS_ID_Enemy_Clan_Uesugi_Respected_09	Other than prayer, there is little the Uesugi can do here. Let them ask heaven for aid! We, on the other hand, will fight like demons from Hell!	true
pre_battle_speeches_text_S2_PBS_ID_Enemy_Clan_Uesugi_Respected_08	Men, we must give the Uesugi enough time to prepare their souls for the afterlife! They are honourable, and deserve that much from us!	true
pre_battle_speeches_text_S2_PBS_ID_Enemy_Clan_Uesugi_Respected_03	I trust that the Uesugi over there are being polite and praying for our souls. It would be a respectful act, and they are honourable men.	true
pre_battle_speeches_text_S2_PBS_ID_Enemy_Clan_Uesugi_Respected_02	The Uesugi banners make a proud display, and the clan has some claim to virtue. I think, though, that in opposing us they confuse wisdom with folly.	true
pre_battle_speeches_text_S2_PBS_ID_Enemy_Clan_Uesugi_Respected_01	Our foes are pious men. We should give the Uesugi enough time for prayer and contemplation. When they are done, we will kill them.	true
pre_battle_speeches_text_S2_PBS_Allies_Enemy_Chosokabe_Here_Adequate_02	So, the Chosokabe, the trusting, easily-fooled Chosokabe, have chosen to support our enemies. This is a pity.	true
pre_battle_speeches_text_S2_PBS_Battle_Land_Weather_No_Guns_Rain_Now_02	Before we are done, we shall be wet, and cold, and miserable. Even so, we are hardy folk, and will fare better than our enemies.	true
pre_battle_speeches_text_S2_PBS_ID_Enemy_Clan_Uesugi_Respected_07	Over there, the Uesugi general offers up prayers for his success and our souls! If I have any say in this battle, his prayers will not be answered!	true
pre_battle_speeches_text_S2_PBS_Allies_Enemy_Chosokabe_Here_Adequate_03	I see the Chosokabe are in the field. They are a simple folk, and probably do not understand that they are aiding fools.	true
pre_battle_speeches_text_S2_PBS_Battle_Land_Weather_No_Guns_Rain_Now_03	So: rain! Do not feel despair at being wet! All soldiers can do with a good wash, our enemies more than most! You will be grateful for that when they are close!	true
pre_battle_speeches_text_S2_PBS_ID_Enemy_Clan_Uesugi_Respected_06	I see the Uesugi banners make a brave sight, thanks to the winds of Fūjin. Appearance, however, is not reality! The Uesugi can pray, but we can fight!	true
pre_battle_speeches_text_S2_PBS_ID_Enemy_Clan_Uesugi_Respected_05	I think Bishamon must look down on the Uesugi yonder with some pride. They are a fine sight! When we are done, matters will be otherwise!	true
pre_battle_speeches_text_S2_PBS_Allies_Enemy_Chosokabe_Here_Adequate_01	I see that the Chosokabe support our enemy, and in goodly numbers too. This is a pity.	true
pre_battle_speeches_text_S2_PBS_Battle_Land_Weather_No_Guns_Rain_Now_01	I do not like this rain! It saps a man's strength and worse, it slows bowmen in shooting. No matter, we shall fight them hand-to-hand. And be wet!	true
pre_battle_speeches_text_S2_PBS_ID_Enemy_Clan_Uesugi_Respected_04	By Bishamon, I do believe our Uesugi enemies are praying for our souls! That is most polite of them, but a wasted effort. Today, they die!	true
pre_battle_speeches_text_S2_PBS_Allies_Clan_Hojo_Near_Maybe_01	I have word that a Hojo army is marching to our aid. We can hope for their help, but not rely on it.	true
pre_battle_speeches_text_S2_PBS_Allies_Clan_Mori_Here_Token_01	I give thanks to the Mori for their support. Although few in number, they are great in spirit, and cunning warriors.	true
pre_battle_speeches_text_S2_PBS_Allies_Clan_Hojo_Near_Maybe_03	Let us hope that the Hojo army can reach us in time. They are good men, but are they practiced in hard marching?	true
pre_battle_speeches_text_S2_PBS_Allies_Clan_Mori_Here_Token_02	I am glad in my heart to see Mori banners alongside ours. Their deceptive skills will put doubt in enemy hearts!	true
pre_battle_speeches_text_S2_PBS_Allies_Clan_Hojo_Near_Maybe_02	An allied Hojo army is marching towards us. Would that they would come soon! I trust they will not go astray!	true
pre_battle_speeches_text_S2_PBS_Allies_Clan_Mori_Here_Token_03	Our foes now ask: where are the rest of the Mori? They will see schemes and tricks where there are none, and be weakened!	true
pre_battle_speeches_text_S2_PBS_Strategy_Enemy_Faction_Grandson_Here_01	Their general is a grandson of the clan leader. It would be a bitter blow to the old man if he were to die!	true
pre_battle_speeches_text_S2_PBS_Strategy_Enemy_Faction_Grandson_Here_03	The death of their general will be well rewarded. Their daimyo will weep to hear of his grandson's death at our hands!	true
pre_battle_speeches_text_S2_PBS_Strategy_Enemy_Faction_Grandson_Here_02	When this battle is done, I want their daimyo to weep for his losses, and for the death of his precious grandson, the enemy general!	true
pre_battle_speeches_text_S2_PBS_Battle_Land_Attack_Castle_Epic_01	My orders to you are simple: we are going to take this fortress. I do not expect that it will be easy. I do expect it to be done. 	true
pre_battle_speeches_text_S2_PBS_Battle_Land_Attack_Castle_Epic_02	My plan is simple: we batter the walls down. Failing that, we go over them. Failing that, ha! I will haunt this place for ten thousand years!	true
pre_battle_speeches_text_S2_PBS_Battle_Land_Attack_Castle_Epic_03	These walls look impossible to take, but they are only as strong as their defenders' will. Break that, and all will fall before you!	true
pre_battle_speeches_text_S2_PBS_Intro_Trait_Drunkard_03	Will you all STAND STILL! Good. I am pleased to see that I command twice as many men as I was expecting. You are all fine warriors, but WHERE'S MY SAKE? URRRRPPPP! Sorry.	true
pre_battle_speeches_text_S2_PBS_Intro_Trait_Drunkard_02	I am famous because of my powerful thirst for sake, it is true! I drink to your health now, and I will drink to our victory later!	true
pre_battle_speeches_text_S2_PBS_Intro_Trait_Drunkard_01	This is going to be a battle, men. I think you may have already worked that out. I did earlier, which is why I'm talking to you now. So, where was I? Yes, a battle. We must drink, oh, fight that sorry lot. 	true
pre_battle_speeches_text_S2_PBS_Strategy_Clan_Battle_Very_Important_02	This fight is about more than victory or our lives. It is a single step along our clan's path to greatness. There is no other way!	true
pre_battle_speeches_text_S2_PBS_Strategy_Clan_Battle_Very_Important_03	We do not fight merely for the pleasure of victory. We fight for our clan's rightful place in Japan. Remember that in what is to come.	true
pre_battle_speeches_text_S2_PBS_Strategy_Clan_Battle_Very_Important_01	I will speak honestly, for you deserve the truth. I need you to fight like demons! Nothing less will do, for victory here is of utmost importance!	true
pre_battle_speeches_text_S2_PBS_Allies_Enemy_Chosokabe_Near_Maybe_01	According to reports, the Chosokabe are marching here to join our enemies. I had hoped for better wisdom from them.	true
pre_battle_speeches_text_S2_PBS_Allies_Enemy_Chosokabe_Near_Maybe_03	I have reports that our foes expect support from the Chosokabe. I also hear that the Chosokabe get lost on their way to the privy!	true
pre_battle_speeches_text_S2_PBS_Allies_Enemy_Chosokabe_Near_Maybe_02	A Chosokabe army is marching here, to support our enemies. Hopefully, they will go astray, like a carelessly shot arrow.	true
pre_battle_speeches_text_S2_PBS_Battle_Land_Weather_Snow_Now_01	The snow is beautiful, is it not? Such perfection should not be marred by bloodstains and brawls. Our enemies, however, insist on so doing.	true
pre_battle_speeches_text_S2_PBS_Battle_Land_Weather_Snow_Now_02	The snow hides much ugliness. It is regretable that we must be disrespectful and spoil so much purity and beauty with blood and battle.	true
pre_battle_speeches_text_S2_PBS_Battle_Land_Weather_Snow_Now_03	There is something clean about snow! I like it! My heart, though, is heavy because our actions today will wipe away this beauty.	true
pre_battle_speeches_text_S2_PBS_Quip_vs_Clan_Hattori_10	I see a Hattori banner over there. That is a great pity, as it spoils an otherwise fine view. Now, shall we go and cut it down?	true
pre_battle_speeches_text_S2_PBS_ID_Enemy_Clan_Takeda_Respected_10	Sometimes the gods must weep to see great men fight and die uselessly. The gods will weep today for the Takeda dead when we are done!	true
pre_battle_speeches_text_S2_PBS_Army_Comparison_Them_Strong_More_Men_03	Our foes make a brave show, but do not be disheartened. Though we are outnumbered, we have honour to sustain us in this testing time!	true
pre_battle_speeches_text_S2_PBS_Army_Comparison_Them_Strong_More_Men_02	I see their strength and numbers are impressive. This will be a hard fight, but I tell you: it will be one worth the winning!	true
pre_battle_speeches_text_S2_PBS_Army_Comparison_Them_Strong_More_Men_01	When the time comes, be resolute. Cut your way into the enemy ranks, then strike all around! Do not consider their numbers. They do not matter.	true
pre_battle_speeches_text_S2_PBS_ID_Enemy_Clan_Takeda_Respected_03	Over there, the Takeda warriors wait for you. Do not think they are unworthy, or cowards, or fools because they march beneath a different banner.	true
pre_battle_speeches_text_S2_PBS_ID_Enemy_Clan_Takeda_Respected_02	There is much to admire in the Takeda clan! Their mountains breed fierce men and fierce loyalties. Yet, measured against you, they are still wanting!	true
pre_battle_speeches_text_S2_PBS_Quip_vs_Clan_Hattori_01	Over there are the Hattori clan. I use the word "clan" but "mob", "rabble" and "murderous gang of cutthroats" are equally accurate. They need to die!	true
pre_battle_speeches_text_S2_PBS_ID_Enemy_Clan_Takeda_Respected_01	The Takeda over there are famed as horse-masters, and rightly so. Being able to ride, however, does not makes them unbeatable. This we will prove.	true
pre_battle_speeches_text_S2_PBS_Quip_vs_Clan_Hattori_02	Now, men, prepare! Our Hattori enemies are notorious for preferring the knife in the dark to an honest sword in battle, so expect trouble!	true
pre_battle_speeches_text_S2_PBS_Quip_vs_Clan_Hattori_03	Men, I will not lie: today we face a gang of murderous bandits and ninja-loving, dishonest mountain monkeys. They are the Hattori, and they are shameless!	true
pre_battle_speeches_text_S2_PBS_ID_Enemy_Clan_Takeda_Respected_07	See: the Takeda have raised their banners! They are a proud clan, and with good reason. It will be a pleasure to defeat such men!	true
pre_battle_speeches_text_S2_PBS_Quip_vs_Clan_Hattori_04	Now comes the hour of battle, but I fear our enemies cannot match our manly virtues. They are the Hattori! Trust nothing you see!	true
pre_battle_speeches_text_S2_PBS_ID_Enemy_Clan_Takeda_Respected_06	Even as I speak to you, our Takeda foes are listening to their general. He is telling them they are fine warriors. I agree, but they need killing!	true
pre_battle_speeches_text_S2_PBS_Quip_vs_Clan_Hattori_05	If honour lives in a single heart in the Hattori ranks, I will faint dead away from the surprise! They are cunning liars to a man!	true
pre_battle_speeches_text_S2_PBS_ID_Enemy_Clan_Takeda_Respected_05	These Takeda are resourceful and hardy men, bred in their mountains from generations of warriors. We would do well to respect their strength!	true
pre_battle_speeches_text_S2_PBS_Quip_vs_Clan_Hattori_06	Ha! So we face the Hattori! This is good, for when we are done there will be fewer living Hattori in the world!	true
pre_battle_speeches_text_S2_PBS_ID_Enemy_Clan_Takeda_Respected_04	The Takeda clan are not fools! Their soldiers are tough and resourceful, and their generals are cultured and clever. Caution should be our watchword!	true
pre_battle_speeches_text_S2_PBS_Quip_vs_Clan_Hattori_07	Warriors! Stand to! Hold to your courage, and beware of everything! These Hattori are as cunning as foxes schooled in cunning by the Chinese!	true
pre_battle_speeches_text_S2_PBS_Quip_vs_Clan_Hattori_08	So now we must make ready, and then slaughter those Hattori fiends yonder. The world will thank us for our efforts, I assure you!	true
pre_battle_speeches_text_S2_PBS_Quip_vs_Clan_Hattori_09	Whatever happens in this battle, keep your wits about you! These Hattori are notorious tricksters, and have an unnatural fondness for ninjas! Expect falsehood!	true
pre_battle_speeches_text_S2_PBS_ID_Enemy_Clan_Takeda_Respected_09	I am saddened to fight the Takeda! They would be worthy allies in our cause, if only their leaders had the wit to see it!	true
pre_battle_speeches_text_S2_PBS_ID_Enemy_Clan_Takeda_Respected_08	Now, look to your enemies, the Takeda! Mark them well, and understand that each of them is a righteous man. We will kill them with decorum!	true
pre_battle_speeches_text_S2_PBS_Allies_Enemy_Chosokabe_Here_Token_01	I see that the Chosokabe have satisfied their honour by sending but a few warriors to support our foes. 	true
pre_battle_speeches_text_S2_PBS_Allies_Enemy_Chosokabe_Here_Token_02	I see the Chosokabe are with our foes. Perhaps it is shame or embarrassment, but I do not count many Chosokabe banners. 	true
pre_battle_speeches_text_S2_PBS_Allies_Enemy_Chosokabe_Here_Token_03	Are those Chosokabe banners I see? Are they not ashamed to offer our foes such desultory aid? I would be, in their position!	true
pre_battle_speeches_text_S2_PBS_Intro_Clan_Takeda_10	And now, we are come to battle, my Takeda brothers. What could be finer? If we fall, we die in the service of our noble clan!	true
pre_battle_speeches_text_S2_PBS_Battle_Land_Defend_Castle_Epic_01	This place is strong! Indeed, a man would have to go far to find its like in these islands! Therefore, we must be worthy of the place, and be strong too.	true
pre_battle_speeches_text_S2_PBS_Battle_Land_Defend_Castle_Epic_02	We will hold these walls even if every Hell-born demon comes against us. But we face only men, so I am not overly concerned!	true
pre_battle_speeches_text_S2_PBS_Battle_Land_Defend_Castle_Epic_03	Our walls are mighty but they are not impregnable! Only the defenders' stout hearts make a fortress unconquerable. The matter is in our hands!	true
pre_battle_speeches_text_S2_PBS_Allies_Clan_Mori_Near_Maybe_01	I have reports that a Mori army is marching even as I speak. I pray that they can arrive before the fight is over!	true
pre_battle_speeches_text_S2_PBS_Allies_Clan_Hojo_Here_Token_01	The great Hojo clan have sent us help. Their numbers are few, it is true, but they are as strong as a fortress in spirit!	true
pre_battle_speeches_text_S2_PBS_Allies_Clan_Hojo_Here_Token_02	Those noble Hojo warriors beside you are most welcome. If their numbers are few, their courage is magnificent!	true
pre_battle_speeches_text_S2_PBS_Allies_Clan_Mori_Near_Maybe_03	We can hope for some aid in this fight. A Mori army is nearby, and may arrive in time. Speed would serve better than cunning!	true
pre_battle_speeches_text_S2_PBS_Allies_Clan_Hojo_Here_Token_03	Briefly, I must thank the Hojo for coming to our aid. I would have thanked them more, if only there had been more of them!	true
pre_battle_speeches_text_S2_PBS_Allies_Clan_Mori_Near_Maybe_02	I hear that a Mori army is close by. Let us hope their natural cunning does not lead them astray, and they arrive in time!	true
pre_battle_speeches_text_S2_PBS_Intro_Clan_Takeda_07	Unfurl our Takeda banners! We are ready now, and our enemies should be told! Let them see our strength, so that fear gnaws at their guts!	true
pre_battle_speeches_text_S2_PBS_Intro_Clan_Takeda_06	There are no prouder boast than these: I am a Takeda general! I lead the greatest warriors in Japan! I never need doubt victory!	true
pre_battle_speeches_text_S2_PBS_Intro_Clan_Takeda_05	Now, Takeda warriors, look to your duties! This is the moment of destiny, when fate guides our swords and we send our enemies to Hell!	true
pre_battle_speeches_text_S2_PBS_Intro_Clan_Takeda_04	Sons of the Takeda! We have much to uphold here today! And I have no doubts that we will acquit ourselves with honour and courage!	true
pre_battle_speeches_text_S2_PBS_Intro_Clan_Takeda_03	Now, soldiers of the Takeda, take heart! Your enemies have seen our banners, and fear begins its work. They do not speak of it, but it is there!	true
pre_battle_speeches_text_S2_PBS_Intro_Clan_Takeda_02	Men of the Takeda clan: it is time to show your worth! Be strong as a mountain wind; fast as a mountain stream; terrible as an avalanche!	true
pre_battle_speeches_text_S2_PBS_Intro_Clan_Takeda_01	We Takeda are famed throughout Japan for our horsemanship. This is entirely right! But we should also be respected for our fierce spirit, bred in the mountains!	true
pre_battle_speeches_text_S2_PBS_Intro_Clan_Takeda_09	Stand ready, you Takeda warriors! Our opponents call us "mountain monkeys" and "horse lovers". In return, I say nothing. We Takeda are better than that!	true
pre_battle_speeches_text_S2_PBS_Intro_Clan_Takeda_08	Noble Takeda, stand ready! We are men of the mountains, as hard as the rocks that bred us! Our enemies will now discover this!	true
pre_battle_speeches_text_S2_PBS_Intro_Trait_Skill_Poet_01	I take up the sword. When will I set it aside? Spring will come again.	true
pre_battle_speeches_text_S2_PBS_Intro_Trait_Skill_Poet_03	There are times when a moment of calm can achieve much. A moment when the soul must have quiet. Before a battle is one of those times.	true
pre_battle_speeches_text_S2_PBS_Intro_Trait_Skill_Poet_02	I am not a warrior, but a thinker. Do not imagine this makes me weak, or unwilling to strive for a victory! Together, we will achieve great things!	true
pre_battle_speeches_text_S2_PBS_Ending_Trait_Skill_Inspiring_01	At the last, I have nothing more to say. You know your duty, as I do mine. Our hearts are strong, so fight well!	true
pre_battle_speeches_text_S2_PBS_Ending_Trait_Skill_Inspiring_02	And now, take up your arms, and realise that you are in the company of brave men. Anything, absolutely anything, is possible for such men!	true
pre_battle_speeches_text_S2_PBS_Ending_Trait_Skill_Inspiring_03	And finally, I know that we are the best of our clan. As long as we have honour, even if we fall here we will not fail here!	true
pre_battle_speeches_text_S2_PBS_Allies_Enemy_Oda_Here_Strong_02	There are many Oda warriors among our enemies today. Some would say too many, but I think we will grow bored counting their heads!	true
pre_battle_speeches_text_S2_PBS_Allies_Enemy_Oda_Here_Strong_03	There are far too many Oda warriors with our foes. We are so dangerous that one clan alone dare not stand against us!	true
