key	text	tooltip
#Loc;1;text/db/pre_battle_speeches.loc		
pre_battle_speeches_text_S2_PBS_Ending_Stock_50	And now set aside all thoughts save duty. Your loved ones will mourn if you die, but not if you fail! Let us have victory!	true
pre_battle_speeches_text_S2_PBS_Quip_Clan_Date_10	Men of the Date clan, our enemies are yonder! Allow them a moment to cleanse their souls, then send them all to heaven!	true
pre_battle_speeches_text_S2_PBS_Allies_Enemy_Hojo_Here_Token_03	I imagine our enemies are most unhappy to see so few of their Hojo allies in the field. But so what? Hojo honour is satisfied.	true
pre_battle_speeches_text_S2_PBS_Allies_Enemy_Mori_Near_Maybe_02	Our foes are waiting for a Mori army to appear and, I presume, save them. Let them wait for ten thousand years!	true
pre_battle_speeches_text_S2_PBS_Allies_Enemy_Hojo_Here_Token_02	The Hojo, I see, are satisfying their honour, but little else. They have sent only a few men to support our foes!	true
pre_battle_speeches_text_S2_PBS_Allies_Enemy_Mori_Near_Maybe_03	Our foes hope to see a Mori army come marching to their support, if the Mori can stop their thievery for long enough to help.	true
pre_battle_speeches_text_S2_PBS_Allies_Enemy_Hojo_Here_Token_01	The Hojo, I see, support our foes. But they do so half-heartedly, with few men, as though ashamed of their friends.	true
pre_battle_speeches_text_S2_PBS_Allies_Enemy_Mori_Near_Maybe_01	I hear that the Mori are marching to aid our foes. Perhaps they will get here, unless their thieving ways slow them!	true
pre_battle_speeches_text_S2_PBS_Army_Enemy_Archers_Too_Many_01	The enemy army is unbalanced, I think. There are many, many archers in the ranks. Too many for my taste, and it weakens the whole.	true
pre_battle_speeches_text_S2_PBS_Army_Enemy_Archers_Too_Many_02	The enemy have some trick in mind. They have many archers: too many, in some ways. They have a cunning plan, or they are foolish.	true
pre_battle_speeches_text_S2_PBS_Army_Enemy_Archers_Too_Many_03	Our foes have been foolish, for their army is not harmonious. They have too many archers in their ranks. This is not strength, but weakness!	true
pre_battle_speeches_text_S2_PBS_Army_Enemy_Samurai_Too_Many_01	I see the enemy have great faith in their samurai. Good for them! I am a practical man, and think their army unbalanced because of it!	true
pre_battle_speeches_text_S2_PBS_Army_Enemy_Samurai_Too_Many_02	Our foes have many samurai in their ranks. They are worthy indeed, but our enemies are weakened by too many of them!	true
pre_battle_speeches_text_S2_PBS_Army_Enemy_Samurai_Too_Many_03	A masterful commander does not rely on one sort of warriors. He masters the uses of all. My opponent has too many samurai in his force!	true
pre_battle_speeches_text_S2_PBS_Reinforce_Clan_Maybe_In_Time_02	There is another reason to be cheerful. Another army approaches, and may yet get here to help with our victory! That is good news!	true
pre_battle_speeches_text_S2_PBS_Reinforce_Clan_Maybe_In_Time_03	And there is good news! Our daimyo is wise: another army marches to us! If they arrive, I will gladly share glory with them.	true
pre_battle_speeches_text_S2_PBS_Reinforce_Clan_Maybe_In_Time_01	Even though our clan brothers are coming, fight as though we alone must win the day! When they arrive, they will be amazed by our courage!	true
pre_battle_speeches_text_S2_PBS_Ending_Stock_40	And when we are done here, the sobs of their widows will rise to the heavens and even the Moon will weep in sympathy!	true
pre_battle_speeches_text_S2_PBS_Ending_Stock_41	And now, remember that honour is at stake! If we lose our honour by fighting shamefully, that is too high a price for victory!	true
pre_battle_speeches_text_S2_PBS_Ending_Stock_42	And now, let us go forward! Our names will live for a thousand years! Raise the banners!	true
pre_battle_speeches_text_S2_PBS_Ending_Stock_43	And now, raise the banners, and cheer! Show the foe that we are coming, and that they should run, if they value their lives!	true
pre_battle_speeches_text_S2_PBS_Ending_Stock_44	And now there is one thing more to do! We are ready, our banners are bright upon the breeze, and the day looks well for us!	true
pre_battle_speeches_text_S2_PBS_Ending_Stock_45	And now, I pray that your ancestors will be proud of your efforts! You are dutiful sons of the clan. There is no finer boast!	true
pre_battle_speeches_text_S2_PBS_Ending_Stock_46	And now comes the test that all wariors must face: open battle. Do not be afraid! You are under my command, and no man here is unworthy!	true
pre_battle_speeches_text_S2_PBS_Ending_Stock_47	And now, I ask the spirits to keep our foes befuddled by their own foolishness. Our wits must be, will be, as sharp as our swords!	true
pre_battle_speeches_text_S2_PBS_Ending_Stock_48	And now, as surely as Mount Fuji touches the clouds, we will have a victory! Good fortune to you all!	true
pre_battle_speeches_text_S2_PBS_Ending_Stock_49	And now, to the enemy! It is impolite to keep them waiting for death any longer! I will enjoy counting their heads afterwards!	true
pre_battle_speeches_text_S2_PBS_Quip_Clan_Date_01	Our enemies are ruled by fear! Warriors, we need only advance beneath our banners, and they will run! Draw your swords! And obey orders!	true
pre_battle_speeches_text_S2_PBS_Quip_Clan_Date_02	Obedience without question is our strength! Fear of our clan, the great Date, is their weakness! Knowing these simple truths, we will triumph today!	true
pre_battle_speeches_text_S2_PBS_Quip_Clan_Date_03	Today's enemies are not be feared, or considered fit opponents for you. They are not Date clan, and that is enough to condemn them as worthless! Now, prepare!	true
pre_battle_speeches_text_S2_PBS_Quip_Clan_Date_04	Our reputation is enough to unman our enemies! They see our Date banners, and they tremble! How many blows will it take to despatch such cowards?	true
pre_battle_speeches_text_S2_PBS_Quip_Clan_Date_05	Stand proud, sons of the Date! Our enemies shake at the sight of us! Now, let duty be your watchword, and show them why they fear us!	true
pre_battle_speeches_text_S2_PBS_Quip_Clan_Date_06	Sons of the Date! Let us treat our foes with all due respect. That is: none at all! Cut them down like so many beasts!	true
pre_battle_speeches_text_S2_PBS_Quip_Clan_Date_07	Let their widows weep for a thousand years after we are done! Any enemy who thinks of this day should tremble when they think of our rage!	true
pre_battle_speeches_text_S2_PBS_Quip_Clan_Date_08	We of the Date clan march below a proud banner! Our enemies rightly fear us, and that fear works for us! Now, forwards!	true
pre_battle_speeches_text_S2_PBS_Quip_Clan_Date_09	Even now, fear does its work in the souls of our enemies. They are right to fear us, for we march beneath the Date banner!	true
pre_battle_speeches_text_S2_PBS_Intro_Trait_Skill_Legendary_01	I have seen many battles! And now I prepare for one more. This is good, for I would have a purpose in my life, and in yours!	true
pre_battle_speeches_text_S2_PBS_Intro_Trait_Skill_Legendary_02	I have spoken many times before battle. It is important that we all understand what is to happen, and work as one. So: listen!	true
pre_battle_speeches_text_S2_PBS_Intro_Trait_Skill_Legendary_03	Once again, I face battle, and in the company of good, honest soldiers. No matter what happens next, I treasure that thought.	true
pre_battle_speeches_text_S2_PBS_ID_Enemy_Clan_Hattori_Hated_10	Over there, beneath that ugly rag they call a banner, is a Hattori general. Even now, he is lying to his men and telling them you are weak: chickens to their foxes.	true
pre_battle_speeches_text_S2_PBS_ID_Enemy_Clan_Shimazu_Hated_01	The Shimazu yonder think themselves better than other men, that their bloodline is more than ours. I say they are wrong! And we will prove it!	true
pre_battle_speeches_text_S2_PBS_ID_Enemy_Clan_Shimazu_Hated_03	The Shimazu are no better than grave-robbers, stealing glory from their long-dead ancestors. Once they were noble, but now? Bah!	true
pre_battle_speeches_text_S2_PBS_ID_Enemy_Clan_Shimazu_Hated_02	The Shimazu account themselves noble, better than lesser men. I think they are misguided; that dung wrapped in a silk kimono is still dung!	true
pre_battle_speeches_text_S2_PBS_ID_Enemy_Clan_Shimazu_Hated_05	Let us consider our Shimazu foes for a moment. They are a sorry collection of ne'er-do-wells and ruffians, the worthless heirs to a worthless clan!	true
pre_battle_speeches_text_S2_PBS_ID_Enemy_Clan_Shimazu_Hated_04	Our Shimazu enemies have a high opinion of themselves, and their ancestors. It must irk them constantly that everyone else thinks differently!	true
pre_battle_speeches_text_S2_PBS_ID_Enemy_Clan_Shimazu_Hated_07	These Shimazu spoil what would otherwise be a pleasing view. Despite their pretensions, they lack any appreciation of beauty. They deserve death a thousand times over.	true
pre_battle_speeches_text_S2_PBS_ID_Enemy_Clan_Shimazu_Hated_06	Over there the Shimazu are waiting. They are long bred to evil and corruption, for that is their heritage. Their banners are marks of dishonour!	true
pre_battle_speeches_text_S2_PBS_ID_Enemy_Clan_Shimazu_Hated_09	The Shimazu have a long history. It is a history befouled by tales of friends betrayed, women violated, and unspeakable sin! And we face them today!	true
pre_battle_speeches_text_S2_PBS_ID_Enemy_Clan_Shimazu_Hated_08	Over there, the Shimazu general is reminding his men of their lineage: a long tale of thievery and deceit, of which he will say nothing. Bah!	true
pre_battle_speeches_text_S2_PBS_ID_Enemy_Rebel_Buddhists_Hated_05	I despise our enemies! They talk of faith, and duty, and enlightenment, but all the time their hearts are full of anger and resentment.	true
pre_battle_speeches_text_S2_PBS_ID_Enemy_Rebel_Buddhists_Hated_04	Those rebels claim their faith is enough reason for their rebellion. There is never enough reason for rebellion! They are faithless to their masters!	true
pre_battle_speeches_text_S2_PBS_ID_Enemy_Rebel_Buddhists_Hated_03	Our foes have masked their rebellion, their ingratitude to their masters, with the false face of piety! They are treacherous, to lie in such a manner!	true
pre_battle_speeches_text_S2_PBS_ID_Enemy_Rebel_Buddhists_Hated_02	To be faithful does not excuse rebellion! Nothing excuses revolt against the natural order of the world! Our foes, therefore, should be hated!	true
pre_battle_speeches_text_S2_PBS_ID_Enemy_Rebel_Buddhists_Hated_01	I do not care for our foes. Their sanctimonious ways and false superiority annoy me beyond all reason. I will be happier when they are dead.	true
pre_battle_speeches_text_S2_PBS_Quip_Clan_Hattori_09	Now, my brave Hattori, fear does its work among our foes! They know our name! They know what we can do! It makes them weak!	true
pre_battle_speeches_text_S2_PBS_Quip_Clan_Hattori_08	Your enemies are shaking, my brave Hattori! Your name alone is enough to terrify them! They are no better than old women and sickly children!	true
pre_battle_speeches_text_S2_PBS_Army_Clan_Artillery_Not_Enough_01	We are ill-prepared in only one thing: we lack artillery. Our efforts to destroy the enemy must be redoubled.	true
pre_battle_speeches_text_S2_PBS_Quip_Clan_Hattori_03	Hattori warriors! Prepare yourselves, but do not waste thought on your foes. They are without honour: nothing but a rabble of farmers and merchants.	true
pre_battle_speeches_text_S2_PBS_Quip_Clan_Hattori_02	Hattori! Stand ready! Now has the hour of destiny come! We face enemies with some courage, but no real honour. They will die dishonoured!	true
pre_battle_speeches_text_S2_PBS_Army_Clan_Artillery_Not_Enough_03	I must confess one thing: we lack artillery. I am sure the general over there will see this, and try to exploit this failing.	true
pre_battle_speeches_text_S2_PBS_Quip_Clan_Hattori_01	Men of the Hattori clan! Our enemies await! Ha! Let us hope our swords are sharp, for I would not want them to suffer as they die!	true
pre_battle_speeches_text_S2_PBS_Army_Clan_Artillery_Not_Enough_02	Having made the necessary calculations, I say we have too little artillery. We must be wary of keeping the enemy at a distance.	true
pre_battle_speeches_text_S2_PBS_Quip_Clan_Hattori_07	When we are done today, all men will understand that we Hattori are to be feared and respected in equal measure! This I swear on my honour!	true
pre_battle_speeches_text_S2_PBS_Quip_Clan_Hattori_06	We will turn this place into a charnel house, a tomb for our enemies and their ignoble ambitions! They will learn to fear the Hattori today!	true
pre_battle_speeches_text_S2_PBS_Quip_Clan_Hattori_05	I am proud of our Hattori banner! Our clan is worthy of loyalty! You are worthy of loyalty! And I will give you victory today!	true
pre_battle_speeches_text_S2_PBS_Quip_Clan_Hattori_04	Warriors, stand ready! Now is the moment to prove that Hattori courage is not lacking, and that all should fear our might!	true
pre_battle_speeches_text_S2_PBS_ID_Enemy_Clan_Hattori_Hated_08	Over their the Hattori banners are flying! Each one is a sign of dishonour, and of murderous treachery. They show brazen gall in daring to face us!	true
pre_battle_speeches_text_S2_PBS_ID_Enemy_Clan_Hattori_Hated_09	Yonder you can see the lying, cruel and false soldiers of a Hattori army. Every one of them is dishonoured, simply by where he stands. Bah! 	true
pre_battle_speeches_text_S2_PBS_ID_Enemy_Clan_Hattori_Hated_01	Our foes, the Hattori, are cunning beasts! Mother foxes send their cubs to learn their vicious tricks from the Hattori. I do not like them.	true
pre_battle_speeches_text_S2_PBS_ID_Enemy_Clan_Hattori_Hated_02	There are no creatures more treacherous than the Hattori! I would spurn them with my foot, but they would steal my sock as I did it!	true
pre_battle_speeches_text_S2_PBS_ID_Enemy_Clan_Hattori_Hated_03	These Hattori devils make common cause with ninjas, bandits, robbers, brigands and all manner of dishonoured swines. I am sorry we must fight them.	true
pre_battle_speeches_text_S2_PBS_ID_Enemy_Clan_Hattori_Hated_04	I have never heard any man say anything good about the Hattori, unless he had a Hattori knife at his throat. They deserve death!	true
pre_battle_speeches_text_S2_PBS_ID_Enemy_Clan_Hattori_Hated_05	One day, perhaps, the gods will strike down the Hattori. Until that day, the job of culling these foxes lies with men like us! 	true
pre_battle_speeches_text_S2_PBS_ID_Enemy_Clan_Hattori_Hated_06	Over there the Hattori are already celebrating their victory. They hold all other clans in contempt. Still, fools die as easily as wise men.	true
pre_battle_speeches_text_S2_PBS_ID_Enemy_Clan_Hattori_Hated_07	I do not like these Hattori at all. They are too fond of the shadows, of murder, and of foul lies to be thought honest warriors.	true
pre_battle_speeches_text_S2_PBS_ID_Enemy_Clan_Shimazu_Hated_10	If there is a Shimazu fool over there more noble than the pigs in a peasant's hut, I will eat my helmet, crest and all!	true
pre_battle_speeches_text_S2_PBS_Allies_Clan_Oda_Here_Strong_01	The Oda clan have honoured us by sending a mighty force to our aid. I thank them for their efforts!	true
pre_battle_speeches_text_S2_PBS_Allies_Clan_Oda_Here_Strong_03	It is a blessing to see that the Oda have come to our aid in such numbers. Their skill in arms is a further blessing!	true
pre_battle_speeches_text_S2_PBS_Allies_Clan_Oda_Here_Strong_02	It is good to see so many Oda banners flying on the breeze. I had only hoped for such commitment to our cause!	true
pre_battle_speeches_text_S2_PBS_Quip_Clan_Hattori_10	When we Hattori are finished today, we will not raise a monument to the enemy dead. Why should be help celebrate fools? They should flee!	true
pre_battle_speeches_text_S2_PBS_Allies_Enemy_Uesugi_Near_Maybe_03	I am told that our foes expect an army of Uesugi allies to appear. I pray their hopes will be dashed.	true
pre_battle_speeches_text_S2_PBS_Allies_Enemy_Uesugi_Near_Maybe_02	There are reports of an Uesugi army nearby. I trust they will find other, pressing matters and not interfere in our affairs.	true
pre_battle_speeches_text_S2_PBS_Allies_Enemy_Uesugi_Near_Maybe_01	I have reports that the Uesugi intend to interfere in the battle, and support our enemies. Let us hope they go astray!	true
pre_battle_speeches_text_S2_PBS_ID_Enemy_Clan_Wee_Faction_Respected_10	It is a sad day when we must cut down the men yonder. Their only errors are to be in the wrong place and to serve the wrong master. 	true
pre_battle_speeches_text_S2_PBS_Allies_Clan_Date_Here_Strong_01	I salute our allies from the Date clan. Their great numbers and fearsome reputation are welcome indeed. 	true
pre_battle_speeches_text_S2_PBS_Allies_Clan_Date_Here_Strong_03	The Date have sent many men to support our efforts. I hope they will have some sword-work when we are done with the foe!	true
pre_battle_speeches_text_S2_PBS_Allies_Clan_Date_Here_Strong_02	It is wonderful to see so many Date banners flying overhead. Their strength is a great aid to our noble cause.	true
pre_battle_speeches_text_S2_PBS_Strategy_Clan_Enemy_Of_State_02	Our clan have been named as outlaws, enemies of Japan. What nonsense! How our foes must fear us to resort to such tricks!	true
pre_battle_speeches_text_S2_PBS_Strategy_Clan_Enemy_Of_State_03	Although we are called enemies of the state, traitors, monsters and worse, we know that we are honourable men of a noble clan. 	true
pre_battle_speeches_text_S2_PBS_Strategy_Clan_Enemy_Of_State_01	Our daimyo has been named an enemy of the state! I say it is the state that is false, to him! What man has done more for Japan? That is why we fight!	true
pre_battle_speeches_text_S2_PBS_Ending_Stock_10	And now, I wish you well of the day! May your names live for ten thousand years!	true
pre_battle_speeches_text_S2_PBS_Ending_Stock_11	And now, attend to your weapons and lace up your armour! The time is upon us! I wish you luck!	true
pre_battle_speeches_text_S2_PBS_Ending_Stock_12	And now, I pray to the spirits that your efforts are blessed! May you all return victorious!	true
pre_battle_speeches_text_S2_PBS_Ending_Stock_13	And so I say this at the last: some of us will fall. Some of us will live! But we will all do our duty!	true
pre_battle_speeches_text_S2_PBS_Ending_Stock_14	And now, shout to the heavens and put fear in our enemies' hearts! Let them know that they face truly dangerous men!	true
pre_battle_speeches_text_S2_PBS_Ending_Stock_15	And lastly, battles are not won by cowards or timid women! Men and hard fighting win battles! And I see men under my command!	true
pre_battle_speeches_text_S2_PBS_Ending_Stock_16	And so, make your last preparations. That done: take heart, and look forward to our glorious victory!	true
pre_battle_speeches_text_S2_PBS_Ending_Stock_17	And remember: the warrior who seeks death while his enemy lives is a fool. I do not command fools! I command you!	true
pre_battle_speeches_text_S2_PBS_Ending_Stock_18	And now, be true to your comrades! Do your duty! That is all, and we will have victory!	true
pre_battle_speeches_text_S2_PBS_Ending_Stock_19	So now we are ready for battle! Like all fights, this will be hard, but do not be worried. We will win!	true
pre_battle_speeches_text_S2_PBS_Ending_Clan_Tokugawa_10	And so to battle! Cheer, and give your enemy a taste of Tokugawa fury! 	true
pre_battle_speeches_text_S2_PBS_Battle_Sea_Defend_Shoals_Impassable_01	There are dangerous rocks and shoals here. Good! Perhaps we can persuade our enemies to go aground, and drown! I do not care how they die!	true
pre_battle_speeches_text_S2_PBS_Battle_Sea_Defend_Shoals_Impassable_02	I intend to use the shoals and hidden rocks to our advantage! Let the enemy come to us, let them founder and drown!	true
pre_battle_speeches_text_S2_PBS_Battle_Sea_Defend_Shoals_Impassable_03	An enemy who is slain because he drives his ship onto the sunken rocks hereabouts is as dead as one who dies by my sword! 	true
pre_battle_speeches_text_S2_PBS_ID_Enemy_Clan_Wee_Faction_Respected_07	Spirits of this place! I apologise for what is to happen! But blame the bravery of our enemies: if they ran away, you would not be offended!	true
pre_battle_speeches_text_S2_PBS_ID_Enemy_Clan_Wee_Faction_Respected_06	Our foes are loyal and brave to their clan and master. I feel a sadness that we must destroy them, but such is the decree of fate! 	true
pre_battle_speeches_text_S2_PBS_ID_Enemy_Clan_Wee_Faction_Respected_05	Even as I speak, our enemies await! They are not of a mighty clan, and they do well not to run from us!	true
pre_battle_speeches_text_S2_PBS_ID_Enemy_Clan_Wee_Faction_Respected_04	Our foes, then, are men of a lesser clan. You might think them unworthy because of it, and you would be wrong! They are warriors!	true
pre_battle_speeches_text_S2_PBS_ID_Enemy_Clan_Wee_Faction_Respected_03	Our foes fly their banners proudly. They have done much in raising up their clan, and deserve their pride. They also deserve death for coming here!	true
pre_battle_speeches_text_S2_PBS_ID_Enemy_Clan_Wee_Faction_Respected_02	I salute our foes! They are warriors of a lesser clan, yet they show greatness in their hearts by facing us! They need killing!	true
pre_battle_speeches_text_S2_PBS_ID_Enemy_Clan_Wee_Faction_Respected_01	Our foes are not yet important in the affairs of Japan. But do not let this fool you: they are dangerous opponents and may yet prove significant.	true
pre_battle_speeches_text_S2_PBS_ID_Enemy_Clan_Wee_Faction_Respected_09	These warriors impress me, a little. Perhaps, in time, their clan might become great and be accounted important. They will never know, for we will kill them.	true
pre_battle_speeches_text_S2_PBS_ID_Enemy_Clan_Wee_Faction_Respected_08	Our enemies are warriors of a lesser clan: they are brave and worthy foes, even if their ambition is too great for their station in life!	true
pre_battle_speeches_text_S2_PBS_Ending_Stock_01	And at the last, do not huddle together for supposed safety! That is not the act of a warrior, only a coward. I do not lead cowards!	true
pre_battle_speeches_text_S2_PBS_Ending_Stock_02	And now, make your peace with your comrades. Check your armour, and put aside all worldly concerns. We go to glory and victory!	true
pre_battle_speeches_text_S2_PBS_Ending_Stock_03	Now pray to the gods, and ask the spirits for their help. Pray to the Christian god too, for all aid is welcome in battle!	true
pre_battle_speeches_text_S2_PBS_Ending_Stock_04	And remember: the cause we defend is a noble one! Our clan is a noble one! Do not prove yourselves base, mean-spirited or cowards!	true
pre_battle_speeches_text_S2_PBS_Allies_Enemy_Uesugi_Here_Adequate_01	I see that our enemies have been joined by a good number of Uesugi warriors. Their powers of persuasion must be better than I thought!	true
pre_battle_speeches_text_S2_PBS_Ending_Stock_05	And now, look into your hearts, and see strength there. We cannot fail, for we fight as one!	true
pre_battle_speeches_text_S2_PBS_Allies_Enemy_Uesugi_Here_Adequate_02	The Uesugi support our foes. I am sorry for it, because I thought the Uesugi wise. Perhaps they were, once.	true
pre_battle_speeches_text_S2_PBS_Ending_Stock_06	And now cheer, and terrify your worthless enemies! Un-man them, weaken their bowels, and show them to be fools for standing before us!	true
pre_battle_speeches_text_S2_PBS_Allies_Enemy_Uesugi_Here_Adequate_03	I am saddened to see our foes have allies. I had thought the Uesugi better than this, but I was wrong. They deserve death.	true
pre_battle_speeches_text_S2_PBS_Ending_Stock_07	And at the last, think  of the glory to come! Duty is very fine, but fame as a warrior is equally worthy!	true
pre_battle_speeches_text_S2_PBS_Ending_Stock_08	And so, let us have a famous victory here! Let our names live forever! Let our cheers shake the gates of Hell!	true
pre_battle_speeches_text_S2_PBS_Ending_Stock_09	And now, do your duty when the time comes! Do only that, and your foes will fall before you!	true
pre_battle_speeches_text_S2_PBS_Ending_Clan_Tokugawa_01	And at the last, remember honour, you brave sons of the Tokugawa! That is more than enough for any man!	true
pre_battle_speeches_text_S2_PBS_Ending_Clan_Tokugawa_03	Now, my honourable Tokugawa brothers, cheer for our clan, and for their defeat! Onwards!	true
pre_battle_speeches_text_S2_PBS_Ending_Clan_Tokugawa_02	And now, Tokugawa warriors, remember your own strength! It is the strength of our clan!	true
pre_battle_speeches_text_S2_PBS_Ending_Clan_Tokugawa_05	Now, lift up our proud Tokugawa banners! Let the foe see them! Let him hear your voices, shouting in triumph!	true
pre_battle_speeches_text_S2_PBS_Ending_Clan_Tokugawa_04	And at the last think carefully about what it means to be Tokugawa. We do not retreat. We do not fail!	true
pre_battle_speeches_text_S2_PBS_Ending_Clan_Tokugawa_07	And remember: enemy widows and orphans will weep when they hear the name of Tokugawa. We will prevail!	true
pre_battle_speeches_text_S2_PBS_Ending_Clan_Tokugawa_06	And now to the fight! My brave Tokugawa, I will be proud to drink sake with any of you, once all our foes are dead!	true
pre_battle_speeches_text_S2_PBS_Allies_Enemy_Hojo_Near_Maybe_02	A Hojo army is marching to our enemies' aid. That will be enough for Hojo honour. Whether they arrive or not will be immaterial.	true
pre_battle_speeches_text_S2_PBS_Allies_Enemy_Mori_Here_Token_03	The Mori, then, have chosen to aid our enemies. I am not impressed by a few pirates, thieves and fisherfolk! 	true
pre_battle_speeches_text_S2_PBS_Ending_Clan_Tokugawa_09	And now, let our foes feel terror at your battle cry! Let them never have peace as long as one Tokugawa lives this day!	true
pre_battle_speeches_text_S2_PBS_Allies_Enemy_Hojo_Near_Maybe_03	The Hojo are, apparently, on their way to support our foes. Perhaps the effort, rather than arriving, will be enough for Hojo honour.	true
