key	text	tooltip
pre_battle_speeches_text_S2_PBS_Army_Clan_Elite_Archers_01	We are fortunate indeed to have such excellent archers in our ranks. Such men are to be valued above pearls, for they have perfected their skill!	true
pre_battle_speeches_text_S2_PBS_Army_Clan_Elite_Archers_03	I am pleased to have such expert archers under my command. I hope to give our enemies a nasty surprise, but one they will not long survive!	true
pre_battle_speeches_text_S2_PBS_Army_Clan_Elite_Archers_02	Among our archers are the finest bowmen in Japan! They will hit the mark! Some have already decided which enemy eye deserves their first arrow!	true
pre_battle_speeches_text_S2_PBS_Allies_Clan_Takeda_Near_Maybe_02	I have heard that the Takeda could reach this battle, if they march hard. Let us hope that they do come to our aid, then.	true
pre_battle_speeches_text_S2_PBS_Allies_Clan_Takeda_Near_Maybe_03	There is a chance that we will see a Takeda army on this field. They may yet come to our aid, the spirits willing!	true
pre_battle_speeches_text_S2_PBS_Allies_Clan_Takeda_Near_Maybe_01	I have word that a Takeda army is approaching. Perhaps they will arrive in time, but for now we look to our own strength.	true
pre_battle_speeches_text_S2_PBS_ID_Enemy_Clan_Chosokabe_Hated_10	When we are finished, I want Chosokabe widows and sisters to weep. This is not as cruel as it sounds, for they are often the same women!	true
pre_battle_speeches_text_S2_PBS_Intro_Stock_Land_And_Sea_01	And so we have come to battle! Why we fight is no concern of mine. It is enough that we uphold the clan's honour!	true
pre_battle_speeches_text_S2_PBS_ID_Enemy_Clan_Mori_Hated_10	Even the crabs, crawling on the bottom of the sea, have heard of the Mori and dislike them. And crabs make infinitely better eating! 	true
pre_battle_speeches_text_S2_PBS_Intro_Stock_Land_And_Sea_03	Greetings, my soldiers! Today will be a good day, if we hold to our creed, do nothing stupid and help those fools to die!	true
pre_battle_speeches_text_S2_PBS_Intro_Stock_Land_And_Sea_02	I know that we face a hard battle, but that is the soldiers' lot. We fight; we die; we win. Today, we do all of them, but especially the last!	true
pre_battle_speeches_text_S2_PBS_Army_Enemy_Spears_Too_Many_01	Our enemies obviously place a great value on spears. I do not think they have studied strategy, to have quite so many!	true
pre_battle_speeches_text_S2_PBS_Intro_Stock_Land_And_Sea_05	I have drawn the sword. I will not set it aside while I live or one foe remains here. I swear on our clan that I will do this!	true
pre_battle_speeches_text_S2_PBS_Intro_Stock_Land_And_Sea_04	Well, then. Here we are, facing an enemy who should open their own bellies in shame, and save us the trouble of killing them!	true
pre_battle_speeches_text_S2_PBS_Army_Enemy_Spears_Too_Many_03	I see our foes have come prepared to defend and hold us at bay. Why else bring so many yari to this fight? But attacking wins battles!	true
pre_battle_speeches_text_S2_PBS_Intro_Stock_Land_And_Sea_07	There is much to be said for a good meal before battle. Satisfied calmness unnerves the enemy! And why go to your death hungry?	true
pre_battle_speeches_text_S2_PBS_Army_Enemy_Spears_Too_Many_02	The general yonder is obviously easily impressed by the size of a man's weapon. That explains why he needs quite so many spearmen!	true
pre_battle_speeches_text_S2_PBS_Intro_Stock_Land_And_Sea_06	I pledge now before you all, my warriors, that I will not set down my sword until the last of us is dead, or victorious!	true
pre_battle_speeches_text_S2_PBS_Intro_Stock_Land_And_Sea_09	There is no better moment for a general than to look at his men, and know that he can trust them, utterly, to do what he asks. So, we begin!	true
pre_battle_speeches_text_S2_PBS_Intro_Stock_Land_And_Sea_08	I look upon our enemies, and I see nothing. They are not men. They are old women, given the forms of men by cruel fate.	true
pre_battle_speeches_text_S2_PBS_Quip_vs_Clan_Oda_10	Now, warriors, is the hour to measure your skills against the Oda. Do not fear! Do your duty when ordered, and all will be well. 	true
pre_battle_speeches_text_S2_PBS_ID_Enemy_Clan_Chosokabe_Hated_09	These Chosokabe test my patience! Why will they not recognise that we are the better men? They are reputed to shoot well enough, but so what?	true
pre_battle_speeches_text_S2_PBS_ID_Enemy_Clan_Chosokabe_Hated_08	If there is a single Chosokabe warrior who has manners, or who understands how to behave well, I have yet to see him. He does not exist!	true
pre_battle_speeches_text_S2_PBS_ID_Enemy_Clan_Chosokabe_Hated_05	We face an unpleasant foe. The Chosokabe were once accounted masters of the bow. Now they are masters only of deceit, cruelty and greed.	true
pre_battle_speeches_text_S2_PBS_ID_Enemy_Clan_Chosokabe_Hated_04	Those Chosokabe are like rotten wood used for a bow: they look acceptable, but beneath the lacquer their foul hearts are eaten away!	true
pre_battle_speeches_text_S2_PBS_ID_Enemy_Clan_Chosokabe_Hated_07	Our Chosokabe enemies are master archers, by some accounts. Good! I would not want to fight with them too closely, because they are unwashed and offensive!	true
pre_battle_speeches_text_S2_PBS_ID_Enemy_Clan_Chosokabe_Hated_06	Do not think of your Chosokabe as men. They are not: geisha have more courage, and gravediggers better manners! It will be pleasing to break them!	true
pre_battle_speeches_text_S2_PBS_ID_Enemy_Clan_Chosokabe_Hated_01	The Chosokabe over there are simple people. They are like an arrow: when ordered, they fly towards their foes until they fall insensible to the ground. Idiots!	true
pre_battle_speeches_text_S2_PBS_ID_Enemy_Clan_Chosokabe_Hated_03	I see a kind stranger has guided the Chosokabe here! This is good, for they might have got lost otherwise! A battle needs both sides!	true
pre_battle_speeches_text_S2_PBS_ID_Enemy_Clan_Chosokabe_Hated_02	One day, perhaps, the Chosokabe will understand their place in the affairs of Japan. One day, perhaps, my horse will learn to write haiku!	true
pre_battle_speeches_text_S2_PBS_ID_Enemy_Clan_Mori_Hated_01	The Mori like to think that they are masters of the sea, lords of the ocean. In fact, they are slightly less valuable than crabs, washed up by a winter storm!	true
pre_battle_speeches_text_S2_PBS_Intro_Stock_Land_And_Sea_11	Now we are ready for this fight. The enemy are drawn up and wait with the respect we are due. I shall not delay matters long.	true
pre_battle_speeches_text_S2_PBS_Intro_Stock_Land_And_Sea_10	Now we await the battle. For some, this is the first time. Do not worry! Like your first lovemaking, it seems confusing until it is over!	true
pre_battle_speeches_text_S2_PBS_ID_Enemy_Clan_Mori_Hated_03	I am surprised that the Mori have managed to gather so many fighters. Perhaps they were expecting boundless sake and numberless whores!	true
pre_battle_speeches_text_S2_PBS_Intro_Stock_Land_And_Sea_13	Yonder, their general is now telling his men what brave souls they are. He tells them the truth. I tell you this: you are better fighters!	true
pre_battle_speeches_text_S2_PBS_ID_Enemy_Clan_Mori_Hated_02	Over there our foes are waiting. They are waiting, as the Mori always do, to rob and loot, for at heart they are thieves not warriors!	true
pre_battle_speeches_text_S2_PBS_Intro_Stock_Land_And_Sea_12	I am ready for the fight! I have said prayers, inspected weapons and armour-- oh, and set aside a flask of sake for our inevitable celebrations!	true
pre_battle_speeches_text_S2_PBS_ID_Enemy_Clan_Mori_Hated_05	The Mori call themselves the lords of the sea. To lesser men, this sounds impressive, I admit. They claim lordship over fish. Hhhhhmmmmmm.	true
pre_battle_speeches_text_S2_PBS_Intro_Stock_Land_And_Sea_15	Over there, another general is speaking to his warriors. He is telling them that you are useless fools. Shall we go and prove him a liar?	true
pre_battle_speeches_text_S2_PBS_ID_Enemy_Clan_Mori_Hated_04	I assume so many Mori have come because they have been promised loot! Usually, it is the only thing that makes them leave their drinking dens!	true
pre_battle_speeches_text_S2_PBS_Intro_Stock_Land_And_Sea_14	So, then, to battle! Death is unwelcome when it is unexpected. Today, expect death. Embrace death, and you will be the perfect soldiers!	true
pre_battle_speeches_text_S2_PBS_ID_Enemy_Clan_Mori_Hated_07	These Mori are hateful, piratical beasts! Would that Ebisu had drowned them all in a seastorm! But he has not, so we must execute them!	true
pre_battle_speeches_text_S2_PBS_Intro_Stock_Land_And_Sea_17	I have come here to command! Some of you will gain great honour! Some will grow rich in loot! But let us all share victory!	true
pre_battle_speeches_text_S2_PBS_ID_Enemy_Clan_Mori_Hated_06	The Mori are sea-creatures, every one! Perhaps, like other fish, they need to be gutted before they are acceptable at dinner! Shall we be about them?	true
pre_battle_speeches_text_S2_PBS_Intro_Stock_Land_And_Sea_16	Beneath those distant banners, my opponent is lying to his men. He is telling them that you are weak and womanly. Shall we prove him a fool?	true
pre_battle_speeches_text_S2_PBS_ID_Enemy_Clan_Mori_Hated_09	These Mori are not men, merely sharks! They are cruel, greedy and insatiable. My humble apologies, but there is little honour in killing them!	true
pre_battle_speeches_text_S2_PBS_Intro_Stock_Land_And_Sea_19	Now we are come to battle! Some of us will fall, like the spring cherry blossoms, while others ride the winds of victory! 	true
pre_battle_speeches_text_S2_PBS_ID_Enemy_Clan_Mori_Hated_08	When we are done with these Mori fools, Ebisu will give thanks to us, I trust! His fishermen will be a little safer from pirates!	true
pre_battle_speeches_text_S2_PBS_Intro_Stock_Land_And_Sea_18	We have not come looking for glory or everlasting fame! Poets will grant those to us for what we do today! We have come looking for a fight!	true
pre_battle_speeches_text_S2_PBS_Quip_vs_Clan_Oda_07	So you will face the Oda clan in battle! So what? They are peasants and follow a lord filled with false pride! You, however, are warriors!	true
pre_battle_speeches_text_S2_PBS_Quip_vs_Clan_Oda_06	That miserable horde are some of the Oda clan. I too would look sour if I served so base a lord! They will be happier dead!	true
pre_battle_speeches_text_S2_PBS_Quip_vs_Clan_Oda_05	So, the Oda have not had the wits to flee! That is a pity: many will die here for their callous lord and his worthless cause!	true
pre_battle_speeches_text_S2_PBS_Quip_vs_Clan_Oda_04	Warriors! Stand to! The Oda have come against us, and they are dangerous foes! We shall have a hard fight, but we shall triumph!	true
pre_battle_speeches_text_S2_PBS_Quip_vs_Clan_Oda_03	The Oda think themselves better than everyone. I say that they are better in one thing only: they die well. Shall we help them die?	true
pre_battle_speeches_text_S2_PBS_Quip_vs_Clan_Oda_02	The Oda have a fierce reputation, but it is built on lies. Warriors such as we should disdain them, then kill them all! Make ready!	true
pre_battle_speeches_text_S2_PBS_Quip_vs_Clan_Oda_01	Our foes have arranged themselves precisely, I see! Let us not keep them waiting! See to it these Oda fools die in the same neat pattern!	true
pre_battle_speeches_text_S2_PBS_Battle_Land_Weather_Enemy_Guns_In_Rain_Now_02	This rain is excellent. It may make you wet, cold and miserable, but it stops the enemy from using their cursed guns! I thank the heavens for it!	true
pre_battle_speeches_text_S2_PBS_Battle_Land_Weather_Enemy_Guns_In_Rain_Now_03	Our foes rely on guns, and rain is the great enemy of guns! Now we will cut them down, and the rain will wash away their blood.	true
pre_battle_speeches_text_S2_PBS_Quip_vs_Clan_Oda_09	Yonder, the Oda commander is telling his men not to be scared! He is wrong in this, for we are his foes! He understands nothing of battle!	true
pre_battle_speeches_text_S2_PBS_Battle_Land_Weather_Enemy_Guns_In_Rain_Now_01	This rain is most welcome, although I hate being wet and cold as much as any man! It is their guns, you see: they are useless in the rain!	true
pre_battle_speeches_text_S2_PBS_Quip_vs_Clan_Oda_08	The scum over there are the Oda clan. Their stench will be gone from Japan if we fight  like the warriors I know us to be!	true
pre_battle_speeches_text_S2_PBS_ID_Enemy_Clan_Hojo_Hated_10	At this moment, the Hojo warriors are being told that you are common, unwashed peasants. Their general is lying to them, trying to instil false courage!	true
pre_battle_speeches_text_S2_PBS_Battle_Sea_Defend_Open_Waters_01	These waters have no dangers, I see. We must rely on ourselves alone to defeat the foe, not the hazards of wind and waves!	true
pre_battle_speeches_text_S2_PBS_Battle_Sea_Defend_Open_Waters_03	Let our enemy come! The sea will not help them! The spirits of these waters surely favour our cause, if there is any justice in them!	true
pre_battle_speeches_text_S2_PBS_Battle_Sea_Defend_Open_Waters_02	Wind and wave favour neither side here! This will be a test of courage and seamanship. Let us be sure we have a surplus of both!	true
pre_battle_speeches_text_S2_PBS_Army_Clan_Elite_Samurai_01	Rightly, I have much faith in our army today! Our samurai are great swordsmen, and follow the old ways! They will triumph!	true
pre_battle_speeches_text_S2_PBS_Army_Clan_Elite_Samurai_03	Samurai! You are the sword, held in my fist! You will be the cutting edge! The enemy will fall before your skills and courage!	true
pre_battle_speeches_text_S2_PBS_Army_Clan_Elite_Samurai_02	In the ranks of our samurai are men who are masters of the sword, the living embodiment of bushido. They stand ready! Follow their example!	true
pre_battle_speeches_text_S2_PBS_ID_Enemy_Clan_Hojo_Hated_04	Over there stand the Hojo. They are like a house, built on river mud. You cannot trust them to stand before a flood such as us!	true
pre_battle_speeches_text_S2_PBS_ID_Enemy_Clan_Hojo_Hated_05	Our Hojo foes are most excellent builders. They have something in common with their fortresses: they are about as intelligent as stones!	true
pre_battle_speeches_text_S2_PBS_ID_Enemy_Clan_Hojo_Hated_06	These Hojo are most comfortable behind strong walls. This is not a sound attitude for a warrior people. Honour requires open, honest battle!	true
pre_battle_speeches_text_S2_PBS_ID_Enemy_Clan_Hojo_Hated_07	The Hojo are accounted fine builders by some, as if manual labour was a matter of pride in warriors! Bah! They are lowly diggers and labourers!	true
pre_battle_speeches_text_S2_PBS_Army_Enemy_Special_Ninja_Lots_01	I believe that our enemies have many ninjas within their ranks. They are, of course, completely treacherous and dishonourable in doing this!	true
pre_battle_speeches_text_S2_PBS_ID_Enemy_Clan_Hojo_Hated_01	Our foes, the cursed Hojo, hold themselves better than other men. And for what reason? Their castles? They know how to stack stones? So do mewling infants!	true
pre_battle_speeches_text_S2_PBS_Army_Enemy_Special_Ninja_Lots_02	I have the suspicion that our enemies will use many ninjas in this battle. Do not fear them! For all their reputation, they bleed and die!	true
pre_battle_speeches_text_S2_PBS_ID_Enemy_Clan_Hojo_Hated_02	Over there, under their scruffy flags, the Hojo await. Their general speaks to them of their bravery. Oh, he must be a great liar!	true
pre_battle_speeches_text_S2_PBS_Army_Enemy_Special_Ninja_Lots_03	Our enemies are most treacherous. Their general has many ninjas under his hand. He will use them dishonourably, I am sure of it!	true
pre_battle_speeches_text_S2_PBS_ID_Enemy_Clan_Hojo_Hated_03	I see our Hojo foes have now gathered themselves into some sort of order! It must be very depressing to be their commander. 	true
pre_battle_speeches_text_S2_PBS_ID_Enemy_Clan_Hojo_Hated_08	The Hojo are not honest samurai! They are less than ronin! They are peasants, labouring in the dirt and pretending to martial glory! Bah!	true
pre_battle_speeches_text_S2_PBS_ID_Enemy_Clan_Hojo_Hated_09	These Hojo think very highly of themselves. Even their banners have an insolence that tests my patience! I thank Bishamon that we are fighting them!	true
pre_battle_speeches_text_S2_PBS_Battle_Sea_Attack_Floating_Mines_01	The enemy are cowards! They have treacerously mined these waters! They dare not meet us in an honest fight, like men! They are filth!	true
pre_battle_speeches_text_S2_PBS_Battle_Sea_Attack_Floating_Mines_03	The wave-spirits will curse our foes today! They are craven monsters, to use sea-mines and so offend the spirits! Even the fish will curse them!	true
pre_battle_speeches_text_S2_PBS_Battle_Sea_Attack_Floating_Mines_02	I do not like our foes' methods. They have little honour and less courage if they are using mines! They are cowards' weapons!	true
pre_battle_speeches_text_S2_PBS_Intro_Family_1_Leader_02	It is a great thing to be your daimyo, especially as we go into battle. Raise high our banners, and let our enemies know we are coming!	true
pre_battle_speeches_text_S2_PBS_Intro_Family_1_Leader_03	If I were given to boasting, reciting your names would be enough to awe our enemies into surrender! But they feign deafness, so we must fight!	true
pre_battle_speeches_text_S2_PBS_Intro_Family_1_Leader_01	I look around and I am proud to be your daimyo. Anyone would say the same! Courage and nobility shine in every one of you!  	true
pre_battle_speeches_text_S2_PBS_Intro_Family_1_Leader_04	I trust that our ancestors are watching today! I want them to see that their descendants are worthy of our great name and I, of leadership!	true
pre_battle_speeches_text_S2_PBS_Intro_Family_1_Leader_05	Today then, we go into battle together. I value every man who does his duty like my own sons. I shall do my duty, and lead you with resolution!	true
pre_battle_speeches_text_S2_PBS_Ending_Trait_Mad_03	So, it has come to battle. I take comfort in knowing that the Moon People have a high regard for my dancing skills! Now we will dance with our swords, to a tune of victory!	true
pre_battle_speeches_text_S2_PBS_Ending_Trait_Mad_02	And now, I fear that I must attack the enemy with or without your help. It is the only way to stop them talking about me. Do not listen to them! I never loved that squid!	true
pre_battle_speeches_text_S2_PBS_Ending_Trait_Mad_01	And now, remember that the enemy are not blessed by fortune. They are men made of rice paper. Yes, rice paper. And chopsticks. Do not fear these spindly bamboo folk!	true
pre_battle_speeches_text_S2_PBS_Intro_Stock_Land_And_Sea_41	As the sword, newly finished by the swordmaker, is ready to be tested, so are we ready for the fight! We will cut cleanly, as does a good blade!	true
pre_battle_speeches_text_S2_PBS_Intro_Stock_Land_And_Sea_40	There is much to be said for not eating before battle. Being hungry sharpens the temper, and anger can be useful when saddled and ridden hard!	true
pre_battle_speeches_text_S2_PBS_Intro_Stock_Land_And_Sea_43	So we face foes who understand nothing of the finer feelings of duty, loyalty and love of home, clan and family. Death will be their reward!	true
pre_battle_speeches_text_S2_PBS_Intro_Stock_Land_And_Sea_42	Our foes have come looking for glory! It is our task to make sure they gain none, and lose everything, even the consolation of duty!	true
pre_battle_speeches_text_S2_PBS_Intro_Stock_Land_And_Sea_45	I look at the enemy banners, and see a symbol dishonoured by cruelty, rapacity, and lust for power. I would kill myself rather than lead them!	true
pre_battle_speeches_text_S2_PBS_Intro_Stock_Land_And_Sea_44	Our foes are beneath contempt! They wear their honour proudly, but it is an actor's mask of lies and deceit! No honest man can stomach them!	true
pre_battle_speeches_text_S2_PBS_Intro_Stock_Land_And_Sea_47	If you meet an honest enemy in this battle, spare him! Bah! What am I saying? If he stands yonder, the man is as dishonest as the rest!	true
pre_battle_speeches_text_S2_PBS_Intro_Stock_Land_And_Sea_46	I am sorry that your enemies today are not more manly and honest! But I am not their general, and can do little about their womanish ways!	true
pre_battle_speeches_text_S2_PBS_Intro_Stock_Land_And_Sea_49	Bishamonten must weep, to see such men call themselves warriors! Would that his tears would drown them all! But we must kill them, and lift his sorrow!	true
pre_battle_speeches_text_S2_PBS_Intro_Stock_Land_And_Sea_48	Our foes, then, are gathered. I am surprised they manage to keep such good order, as they normally fall to stealing from each other!	true
pre_battle_speeches_text_S2_PBS_Allies_Enemy_Hattori_Here_Strong_01	Our foes have friends, then: I see Hattori banners over there! And far too many of them for my liking. No matter! They are scum.	true
pre_battle_speeches_text_S2_PBS_Allies_Enemy_Hattori_Here_Strong_03	Over there you will see many Hattori banners. So our enemies have allies: think nothing of it! They are worthless mountain bandits, not warriors!	true
pre_battle_speeches_text_S2_PBS_Allies_Enemy_Hattori_Here_Strong_02	I am saddened to see so many Hattori warriors alongside our foes. I had hoped that our enemies had some care for their honour.	true
pre_battle_speeches_text_S2_PBS_Quip_vs_Shogun_Ashikaga_01	Warriors! Set aside all respect! The Ashikaga you face are base and traitorous! They serve one who plays at being shogun. Kill them all!	true
pre_battle_speeches_text_S2_PBS_Quip_vs_Shogun_Ashikaga_03	We fight the Ashikaga! They stand for the indefensible and dishonourable! Right and strength are ours, weakness and death will be theirs! Forwards!	true
pre_battle_speeches_text_S2_PBS_Quip_vs_Shogun_Ashikaga_02	Warriors! Today we kill men who are loyal to a fool! They do not deserve such an end! But do not let sympathy weaken your blows!	true
pre_battle_speeches_text_S2_PBS_Quip_vs_Shogun_Ashikaga_05	Do not think that we are the rebels here! They are traitors to everyone in this land, for they support a weakling! Now, make ready!	true
pre_battle_speeches_text_S2_PBS_Quip_vs_Shogun_Ashikaga_04	The warriors of this ghost shogun do not deserve our respect! Today, they deserve to die at your hands, sent to serve in Hell!	true
pre_battle_speeches_text_S2_PBS_Quip_vs_Shogun_Ashikaga_07	I would see these Ashikaga fools dead before the next sunset! Their weakness and cowardice are a stain on the character of the Japanese people!	true
pre_battle_speeches_text_S2_PBS_Quip_vs_Shogun_Ashikaga_06	If the Ashikaga had honour, they would kill themselves. They have ruined our land, and must pay the price. What we do today is a start!	true
pre_battle_speeches_text_S2_PBS_Quip_vs_Shogun_Ashikaga_09	Are the Ashikaga witless? Can they not see that their time is over? Why must we fight? Ah! They are stubborn! We must show them their folly!	true
pre_battle_speeches_text_S2_PBS_Quip_vs_Shogun_Ashikaga_08	Our Ashikaga foes serve a lord who is base, treacherous and unworthy of his position. If they had any sense, they would run or die of shame!	true
pre_battle_speeches_text_S2_PBS_Allies_Clan_Takeda_Here_Token_03	We are honoured to have the Takeda stand beside us. Their numbers are few, but their skills in war are not measured by counting!	true
pre_battle_speeches_text_S2_PBS_Allies_Clan_Takeda_Here_Token_02	I offer my thanks to our Takeda allies. I am glad to see that so many brave Takeda warriors could be persuaded to come here.	true
pre_battle_speeches_text_S2_PBS_Allies_Clan_Takeda_Here_Token_01	It is good to see that the Takeda clan has honoured its obligation to us. I only wish they were here in greater numbers!	true
pre_battle_speeches_text_S2_PBS_Intro_Stock_Land_And_Sea_50	By the Seven Lucky Gods! Here are men worthy of death, and here we are with the means to visit the punishment of the heavens upon them! 	true
pre_battle_speeches_text_S2_PBS_Quip_vs_Shogun_Ashikaga_10	Those fools think that they serve a worthy lord! They do not! They must die! The Ashikaga have brought nothing but disgrace to the shogunate!	true
pre_battle_speeches_text_S2_PBS_Intro_Family_3_Son_05	I would give my father a present from today: a count of heads to make his own head spin! A great victory is always savoured more than a small one!	true
pre_battle_speeches_text_S2_PBS_Intro_Family_3_Son_04	I would not be my father's son if I did not intend to win this fight! Looking at you, I know I have the men here to do just that!	true
pre_battle_speeches_text_S2_PBS_Intro_Family_3_Son_03	My father looks for a victory today, and I do not mean to disappoint him. I know that you feel the same way!	true
pre_battle_speeches_text_S2_PBS_Intro_Family_3_Son_02	My father has given me command. The general's burdens are many, but I am fortunate: I have you men to lead!	true
pre_battle_speeches_text_S2_PBS_Intro_Family_3_Son_01	I look at you, and know that I will not disappoint my father today! A general in charge of such men is blessed by heaven!	true
pre_battle_speeches_text_S2_PBS_Intro_Clan_Hattori_01	We Hattori have an unfortunate reputation for deceit, cruelty and war-making! Excellent! This means our name is already a sword-cut into the enemies' bellies!	true
pre_battle_speeches_text_S2_PBS_Intro_Clan_Hattori_02	Hattori warriors! After our today, those who hear of our deeds here should shudder with terror! We must be demons of battle, not men!	true
pre_battle_speeches_text_S2_PBS_Intro_Clan_Hattori_03	Now, brave Hattori, stand proudly beneath our banners! Let the enemy see you, and let them fear! Their hearts weaken, and they are already lost!	true
pre_battle_speeches_text_S2_PBS_Intro_Clan_Hattori_04	I will not keep you long, my brave Hattori warriors! All is ready, and you need no encouragement from me to fight like proper men!	true
pre_battle_speeches_text_S2_PBS_Intro_Clan_Hattori_05	We Hattori are hardy, resourceful and clever! We have to be, for our mountain home is harsh and unforgiving! We know the world is against us!	true
pre_battle_speeches_text_S2_PBS_Intro_Clan_Hattori_06	Raise high our banners, my Hattori warriors! Let the enemy see who has come to kill them! Look round: remember we are right to be proud!	true
